,Unnamed: 0.1,Unnamed: 0,paragraph,append,dialogue,speaker,addressee,subject,sentiment,chapter,syntactic,referringExpression,probability_sp,probability_ad
568,568,568,569," and she walked on, amusing herself in the consideration of the blunders which often arise from a partial knowledge of circumstances, of the mistakes which people of high pretensions to judgment are for ever falling into; and not very well pleased with her brother for imagining her blind and ignorant, and in want of counsel. He said no more.","I thank you; but I assure you you are quite mistaken. Mr. Elton and I are very good friends, and nothing more;",Emma,Harriet Smith,NO MONOLOGUE,0,13,Implicit,,0.4301038283315173,0.4309726798738661
571,571,571,572," said he, ","A man, /newquote must have a very good opinion of himself when he asks people to leave their own fireside, and encounter such a day as this, for the sake of coming to see him. He must think himself a most agreeable fellow; I could not do such a thing. It is the greatest absurdity--Actually snowing at this moment!--The folly of not allowing people to be comfortable at home--and the folly of people's not staying comfortably at home when they can! If we were obliged to go out such an evening as this, by any call of duty or business, what a hardship we should deem it;--and here are we, probably with rather thinner clothing than usual, setting forward voluntarily, without excuse, in defiance of the voice of nature, which tells man, in every thing given to his view or his feelings, to stay at home himself, and keep all under shelter that he can;--here are we setting forward to spend five dull hours in another man's house, with nothing to say or to hear that was not said and heard yesterday, and may not be said and heard again to-morrow. Going in dismal weather, to return probably in worse;--four horses and four servants taken out for nothing but to convey five idle, shivering creatures into colder rooms and worse company than they might have had at home.",Mr. Knightley,Emma,NO MONOLOGUE,0,13,Anaphoric,said he,0.4147799136602624,0.2186884484817426
572,572,572,573,"Emma did not find herself equal to give the pleased assent, which no doubt he was in the habit of receiving, to emulate the  /newquote  which must have been usually administered by his travelling companion; but she had resolution enough to refrain from making any answer at all. She could not be complying, she dreaded being quarrelsome; her heroism reached only to silence. She allowed him to talk, and arranged the glasses, and wrapped herself up, without opening her lips.","Very true, my love,",Mr. Knightley,Emma,NO MONOLOGUE,0,13,Anaphoric,he murmured,0.4181706955131892,0.3679427334725019
598,598,598,599,NO APPEND,"We want only two more to be just the right number. I should like to see two more here,--your pretty little friend, Miss Smith, and my son--and then I should say we were quite complete. I believe you did not hear me telling the others in the drawing-room that we are expecting Frank. I had a letter from him this morning, and he will be with us within a fortnight.",Emma,Harriet Smith,NO MONOLOGUE,0,14,Anaphoric,he made use of the very first interval in the cares of hospitality the very first leisure from the saddle of mutton to say to her,0.5690851630782234,0.3002370029305148
600,600,600,601," continued Mr. Weston, ","He has been wanting to come to us, /newquote ever since September: every letter has been full of it; but he cannot command his own time. He has those to please who must be pleased, and who (between ourselves) are sometimes to be pleased only by a good many sacrifices. But now I have no doubt of seeing him here about the second week in January.",Mr. Weston,Emma,NO MONOLOGUE,0,14,Explicit,continued Mr Weston,0.9937875870563138,0.3532161422914787
601,601,601,602,NO APPEND,"What a very great pleasure it will be to you! and Mrs. Weston is so anxious to be acquainted with him, that she must be almost as happy as yourself.",Emma,Mr. Weston,NO MONOLOGUE,0,14,Implicit,,0.419667031731162,0.1027508038228254
602,602,602,603,NO APPEND,"Yes, she would be, but that she thinks there will be another put-off. She does not depend upon his coming so much as I do: but she does not know the parties so well as I do. The case, you see, is--(but this is quite between ourselves: I did not mention a syllable of it in the other room. There are secrets in all families, you know)--The case is, that a party of friends are invited to pay a visit at Enscombe in January; and that Frank's coming depends upon their being put off. If they are not put off, he cannot stir. But I know they will, because it is a family that a certain lady, of some consequence, at Enscombe, has a particular dislike to: and though it is thought necessary to invite them once in two or three years, they always are put off when it comes to the point. I have not the smallest doubt of the issue. I am as confident of seeing Frank here before the middle of January, as I am of being here myself: but your good friend there (nodding towards the upper end of the table) has so few vagaries herself, and has been so little used to them at Hartfield, that she cannot calculate on their effects, as I have been long in the practice of doing.",Emma,Harriet Smith,NO MONOLOGUE,0,14,Implicit,,0.4406841920390595,0.0668127031771332
603,603,603,604, replied Emma; ,"I am sorry there should be any thing like doubt in the case, /newquote but am disposed to side with you, Mr. Weston. If you think he will come, I shall think so too; for you know Enscombe.",Emma,Mr. Weston,NO MONOLOGUE,0,14,Explicit,replied Emma,0.995574048059691,0.2038480550284984
604,604,604,605,NO APPEND,"Yes--I have some right to that knowledge; though I have never been at the place in my life.--She is an odd woman!--But I never allow myself to speak ill of her, on Frank's account; for I do believe her to be very fond of him. I used to think she was not capable of being fond of any body, except herself: but she has always been kind to him (in her way--allowing for little whims and caprices, and expecting every thing to be as she likes). And it is no small credit, in my opinion, to him, that he should excite such an affection; for, though I would not say it to any body else, she has no more heart than a stone to people in general; and the devil of a temper.",Emma,Mrs. Weston,NO MONOLOGUE,0,14,Implicit,,0.4111718740221163,0.4291886235252474
605,605,605,606,"Emma liked the subject so well, that she began upon it, to Mrs. Weston, very soon after their moving into the drawing-room: wishing her joy--yet observing, that she knew the first meeting must be rather alarming.-- Mrs. Weston agreed to it; but added, that she should be very glad to be secure of undergoing the anxiety of a first meeting at the time talked of: ","for I cannot depend upon his coming. I cannot be so sanguine as Mr. Weston. I am very much afraid that it will all end in nothing. Mr. Weston, I dare say, has been telling you exactly how the matter stands?",Mrs. Weston,Emma,NO MONOLOGUE,0,14,Explicit,Mrs Weston agreed to it but added,0.9678681189697624,0.5790269113560056
606,606,606,607,NO APPEND,"Yes--it seems to depend upon nothing but the ill-humour of Mrs. Churchill, which I imagine to be the most certain thing in the world.",Emma,Mrs. Weston,NO MONOLOGUE,0,14,Implicit,,0.4174990696057905,0.9189561950068358
611,611,611,612,NO APPEND,"And so you do not consider this visit from your son as by any means certain. I am sorry for it. The introduction must be unpleasant, whenever it takes place; and the sooner it could be over, the better.",Emma,Mr. Knightley,NO MONOLOGUE,0,14,Explicit,Emma found an opportunity of saying,0.994920312291348,0.0445738395309163
612,612,612,613,NO APPEND,"Yes; and every delay makes one more apprehensive of other delays. Even if this family, the Braithwaites, are put off, I am still afraid that some excuse may be found for disappointing us. I cannot bear to imagine any reluctance on his side; but I am sure there is a great wish on the Churchills' to keep him to themselves. There is jealousy. They are jealous even of his regard for his father. In short, I can feel no dependence on his coming, and I wish Mr. Weston were less sanguine.",Emma,Mr. Knightley,NO MONOLOGUE,0,14,Implicit,,0.4443884943582376,0.0571652356831317
613,613,613,614, said Emma. ,"He ought to come, /newquote If he could stay only a couple of days, he ought to come; and one can hardly conceive a young man's not having it in his power to do as much as that. A young _woman_, if she fall into bad hands, may be teased, and kept at a distance from those she wants to be with; but one cannot comprehend a young _man_'s being under such restraint, as not to be able to spend a week with his father, if he likes it.",Emma,Mrs. Weston,NO MONOLOGUE,0,14,Explicit,said Emma,0.9950681474048984,0.4180146201562634
614,614,614,615, replied Mrs. Weston. ,"One ought to be at Enscombe, and know the ways of the family, before one decides upon what he can do, /newquote One ought to use the same caution, perhaps, in judging of the conduct of any one individual of any one family; but Enscombe, I believe, certainly must not be judged by general rules: _she_ is so very unreasonable; and every thing gives way to her.",Mrs. Weston,Emma,NO MONOLOGUE,0,14,Explicit,replied Mrs Weston,0.974411321215248,0.592802183374952
615,615,615,616,NO APPEND,"But she is so fond of the nephew: he is so very great a favourite. Now, according to my idea of Mrs. Churchill, it would be most natural, that while she makes no sacrifice for the comfort of the husband, to whom she owes every thing, while she exercises incessant caprice towards _him_, she should frequently be governed by the nephew, to whom she owes nothing at all.",Emma,Mrs. Weston,NO MONOLOGUE,0,14,Implicit,,0.4205337814040806,0.5037922534847978
616,616,616,617,NO APPEND,"My dearest Emma, do not pretend, with your sweet temper, to understand a bad one, or to lay down rules for it: you must let it go its own way. I have no doubt of his having, at times, considerable influence; but it may be perfectly impossible for him to know beforehand _when_ it will be.",Mr. Knightley,Emma,NO MONOLOGUE,0,14,Implicit,,0.2187847622324331,0.7683067438819162
617,617,617,618,"Emma listened, and then coolly said, ","I shall not be satisfied, unless he comes.",Emma,Mrs. Weston,NO MONOLOGUE,0,14,Explicit,Emma listened and then coolly said,0.9951221101182156,0.4069241428285992
618,618,618,619," continued Mrs. Weston, ","He may have a great deal of influence on some points, /newquote and on others, very little: and among those, on which she is beyond his reach, it is but too likely, may be this very circumstance of his coming away from them to visit us.",Mrs. Weston,Emma,NO MONOLOGUE,0,14,Explicit,continued Mrs Weston,0.969105109080612,0.4014810777438992
621,621,621,622,"He professed himself extremely anxious about her fair friend--her fair, lovely, amiable friend.  /newquote   And in this style he talked on for some time very properly, not much attending to any answer, but altogether sufficiently awake to the terror of a bad sore throat; and Emma was quite in charity with him.","Did she know?--had she heard any thing about her, since their being at Randalls?--he felt much anxiety--he must confess that the nature of her complaint alarmed him considerably.",Mr. Knightley,Mrs. Weston,NO MONOLOGUE,0,15,Explicit,exclaimed Mr Knightley,0.9693559647851412,0.4014135351202437
636,636,636,637,NO APPEND,Your father will not be easy; why do not you go?,Emma,Mrs. Weston,NO MONOLOGUE,0,15,Implicit,,0.4405074585834628,0.0554335270596301
637,637,637,638,NO APPEND,"I am ready, if the others are.",Emma,Mr. Knightley,NO MONOLOGUE,0,15,Implicit,,0.3982640495712591,0.0425274383627477
638,638,638,639,NO APPEND,Shall I ring the bell?,Emma,Mr. Knightley,NO MONOLOGUE,0,15,Implicit,,0.4065681145615937,0.0452766020651403
639,639,639,640,NO APPEND,"Yes, do.",Emma,Mr. Knightley,NO MONOLOGUE,0,15,Implicit,,0.4318243712622109,0.0545737785203028
644,644,644,645,NO APPEND,"I am very much astonished, Mr. Elton. This to _me_! you forget yourself--you take me for my friend--any message to Miss Smith I shall be happy to deliver; but no more of this to _me_, if you please.",Emma,Mr. Knightley,NO MONOLOGUE,0,15,Anaphoric,she replied,0.6062150530630575,0.0875174386625623
645,645,645,646,"--And he repeated her words with such assurance of accent, such boastful pretence of amazement, that she could not help replying with quickness,",Miss Smith!--message to Miss Smith!--What could she possibly mean!,Emma,Mr. Knightley,NO MONOLOGUE,0,15,Implicit,,0.4341821253669438,0.0776034367127921
646,646,646,647,NO APPEND,"Mr. Elton, this is the most extraordinary conduct! and I can account for it only in one way; you are not yourself, or you could not speak either to me, or of Harriet, in such a manner. Command yourself enough to say no more, and I will endeavour to forget it.",Emma,Harriet Smith,NO MONOLOGUE,0,15,Anaphoric,she could not help replying,0.5981480194130615,0.4319567436699025
649,649,649,650,NO APPEND,"It is impossible for me to doubt any longer. You have made yourself too clear. Mr. Elton, my astonishment is much beyond any thing I can express. After such behaviour, as I have witnessed during the last month, to Miss Smith--such attentions as I have been in the daily habit of observing--to be addressing me in this manner--this is an unsteadiness of character, indeed, which I had not supposed possible! Believe me, sir, I am far, very far, from gratified in being the object of such professions.",Emma,Mr. Elton,NO MONOLOGUE,0,15,Anaphoric,she thought more of his inconstancy and presumption and with fewer struggles for politeness replied,0.6032359604740213,0.2703303924858386
650,650,650,651," cried Mr. Elton, ","Good Heaven! /newquote what can be the meaning of this?--Miss Smith!--I never thought of Miss Smith in the whole course of my existence--never paid her any attentions, but as your friend: never cared whether she were dead or alive, but as your friend. If she has fancied otherwise, her own wishes have misled her, and I am very sorry--extremely sorry--But, Miss Smith, indeed!--Oh! Miss Woodhouse! who can think of Miss Smith, when Miss Woodhouse is near! No, upon my honour, there is no unsteadiness of character. I have thought only of you. I protest against having paid the smallest attention to any one else. Every thing that I have said or done, for many weeks past, has been with the sole view of marking my adoration of yourself. You cannot really, seriously, doubt it. No!--(in an accent meant to be insinuating)--I am sure you have seen and understood me.",Mr. Elton,Harriet Smith,NO MONOLOGUE,0,15,Explicit,cried Mr Elton,0.9901273852336148,0.47058624950763
652,652,652,653,NO APPEND,Charming Miss Woodhouse! allow me to interpret this interesting silence. It confesses that you have long understood me.,Mr. Frank Churchill,Emma,NO MONOLOGUE,0,15,Anaphoric,he joyously exclaimed,0.1065706842657849,0.2972454964939827
653,653,653,654," cried Emma, ","No, sir, /newquote it confesses no such thing. So far from having long understood you, I have been in a most complete error with respect to your views, till this moment. As to myself, I am very sorry that you should have been giving way to any feelings--Nothing could be farther from my wishes--your attachment to my friend Harriet--your pursuit of her, (pursuit, it appeared,) gave me great pleasure, and I have been very earnestly wishing you success: but had I supposed that she were not your attraction to Hartfield, I should certainly have thought you judged ill in making your visits so frequent. Am I to believe that you have never sought to recommend yourself particularly to Miss Smith?--that you have never thought seriously of her?",Emma,Mr. Frank Churchill,NO MONOLOGUE,0,15,Explicit,cried Emma,0.9942196740145638,0.1689392429348244
654,654,654,655," cried he, affronted in his turn: ","Never, madam, /newquote never, I assure you. _I_ think seriously of Miss Smith!--Miss Smith is a very good sort of girl; and I should be happy to see her respectably settled. I wish her extremely well: and, no doubt, there are men who might not object to--Every body has their level: but as for myself, I am not, I think, quite so much at a loss. I need not so totally despair of an equal alliance, as to be addressing myself to Miss Smith!--No, madam, my visits to Hartfield have been for yourself only; and the encouragement I received--",Mr. Knightley,Emma,NO MONOLOGUE,0,15,Anaphoric,cried he,0.0943269652095843,0.551124910996647
655,655,655,656,NO APPEND,"Encouragement!--I give you encouragement!--Sir, you have been entirely mistaken in supposing it. I have seen you only as the admirer of my friend. In no other light could you have been more to me than a common acquaintance. I am exceedingly sorry: but it is well that the mistake ends where it does. Had the same behaviour continued, Miss Smith might have been led into a misconception of your views; not being aware, probably, any more than myself, of the very great inequality which you are so sensible of. But, as it is, the disappointment is single, and, I trust, will not be lasting. I have no thoughts of matrimony at present.",Emma,Harriet Smith,NO MONOLOGUE,0,15,Implicit,,0.3881819407434702,0.503069108213724
661,661,661,662,"The picture!--How eager he had been about the picture!--and the charade!--and an hundred other circumstances;--how clearly they had seemed to point at Harriet. To be sure, the charade, with its  /newquote --but then the  /newquote --in fact it suited neither; it was a jumble without taste or truth. Who could have seen through such thick-headed nonsense?",ready wit /newquote soft eyes,Emma,Harriet Smith,NO MONOLOGUE,0,16,Implicit,,0.442568441231375,0.0912442022844857
676,676,676,677,NO APPEND,"Ah! Mr. Knightley, why do not you stay at home like poor Mr. Elton?",Mr. Frank Churchill,Mr. Knightley,NO MONOLOGUE,0,16,Anaphoric,him say to Mr Knightley,0.1813461889036037,0.2404831146648401
693,693,693,694,"Mr. Frank Churchill did not come. When the time proposed drew near, Mrs. Weston's fears were justified in the arrival of a letter of excuse. For the present, he could not be spared, to his ",very great mortification and regret; but still he looked forward with the hope of coming to Randalls at no distant period.,Harriet Smith,Emma,NO MONOLOGUE,0,18,Explicit,Harriet unchecked ran eagerly through what she had to tell,0.9976498405985508,0.2174781299325794
698,698,698,699," said Mr. Knightley, coolly; ","The Churchills are very likely in fault, /newquote but I dare say he might come if he would.",Mr. Knightley,Emma,NO MONOLOGUE,0,18,Explicit,said Mr Knightley,0.9895344654888242,0.3729084516939208
699,699,699,700,NO APPEND,I do not know why you should say so. He wishes exceedingly to come; but his uncle and aunt will not spare him.,Emma,Mr. Knightley,NO MONOLOGUE,0,18,Implicit,,0.4195173704486482,0.2655093470336005
700,700,700,701,NO APPEND,"I cannot believe that he has not the power of coming, if he made a point of it. It is too unlikely, for me to believe it without proof.",Emma,Harriet Smith,NO MONOLOGUE,0,18,Implicit,,0.4259598605012366,0.0753936444966081
701,701,701,702,NO APPEND,"How odd you are! What has Mr. Frank Churchill done, to make you suppose him such an unnatural creature?",Emma,Harriet Smith,NO MONOLOGUE,0,18,Implicit,,0.4385918724982787,0.0870209537734753
702,702,702,703,NO APPEND,"I am not supposing him at all an unnatural creature, in suspecting that he may have learnt to be above his connexions, and to care very little for any thing but his own pleasure, from living with those who have always set him the example of it. It is a great deal more natural than one could wish, that a young man, brought up by those who are proud, luxurious, and selfish, should be proud, luxurious, and selfish too. If Frank Churchill had wanted to see his father, he would have contrived it between September and January. A man at his age--what is he?--three or four-and-twenty--cannot be without the means of doing as much as that. It is impossible.",Emma,Mr. Knightley,NO MONOLOGUE,0,18,Implicit,,0.3923945540923453,0.0571652356831317
703,703,703,704,NO APPEND,"That's easily said, and easily felt by you, who have always been your own master. You are the worst judge in the world, Mr. Knightley, of the difficulties of dependence. You do not know what it is to have tempers to manage.",Emma,Mr. Knightley,NO MONOLOGUE,0,18,Implicit,,0.3969361182028664,0.3052436056530538
704,704,704,705,NO APPEND,"It is not to be conceived that a man of three or four-and-twenty should not have liberty of mind or limb to that amount. He cannot want money--he cannot want leisure. We know, on the contrary, that he has so much of both, that he is glad to get rid of them at the idlest haunts in the kingdom. We hear of him for ever at some watering-place or other. A little while ago, he was at Weymouth. This proves that he can leave the Churchills.",Emma,Mrs. Weston,NO MONOLOGUE,0,18,Implicit,,0.4144791084099395,0.0530853444248293
705,705,705,706,NO APPEND,"Yes, sometimes he can.",Emma,Mr. Knightley,NO MONOLOGUE,0,18,Implicit,,0.4212820640314916,0.0719403355645921
706,706,706,707,NO APPEND,And those times are whenever he thinks it worth his while; whenever there is any temptation of pleasure.,Emma,Mr. Knightley,NO MONOLOGUE,0,18,Implicit,,0.250475173558553,0.0836721417285765
707,707,707,708,NO APPEND,"It is very unfair to judge of any body's conduct, without an intimate knowledge of their situation. Nobody, who has not been in the interior of a family, can say what the difficulties of any individual of that family may be. We ought to be acquainted with Enscombe, and with Mrs. Churchill's temper, before we pretend to decide upon what her nephew can do. He may, at times, be able to do a great deal more than he can at others.",Emma,Mr. Knightley,NO MONOLOGUE,0,18,Implicit,,0.2337960416236393,0.3235011816592315
708,708,708,709,NO APPEND,"There is one thing, Emma, which a man can always do, if he chuses, and that is, his duty; not by manoeuvring and finessing, but by vigour and resolution. It is Frank Churchill's duty to pay this attention to his father. He knows it to be so, by his promises and messages; but if he wished to do it, it might be done. A man who felt rightly would say at once, simply and resolutely, to Mrs. Churchill--'Every sacrifice of mere pleasure you will always find me ready to make to your convenience; but I must go and see my father immediately. I know he would be hurt by my failing in such a mark of respect to him on the present occasion. I shall, therefore, set off to-morrow.'--If he would say so to her at once, in the tone of decision becoming a man, there would be no opposition made to his going.",Mr. Knightley,Emma,NO MONOLOGUE,0,18,Implicit,,0.1726829449465959,0.7723446079558808
709,709,709,710," said Emma, laughing; ","No, /newquote but perhaps there might be some made to his coming back again. Such language for a young man entirely dependent, to use!--Nobody but you, Mr. Knightley, would imagine it possible. But you have not an idea of what is requisite in situations directly opposite to your own. Mr. Frank Churchill to be making such a speech as that to the uncle and aunt, who have brought him up, and are to provide for him!--Standing up in the middle of the room, I suppose, and speaking as loud as he could!--How can you imagine such conduct practicable?",Emma,Mr. Knightley,NO MONOLOGUE,0,18,Explicit,said Emma,0.9934126313818724,0.9706657680076904
710,710,710,711,NO APPEND,"Depend upon it, Emma, a sensible man would find no difficulty in it. He would feel himself in the right; and the declaration--made, of course, as a man of sense would make it, in a proper manner--would do him more good, raise him higher, fix his interest stronger with the people he depended on, than all that a line of shifts and expedients can ever do. Respect would be added to affection. They would feel that they could trust him; that the nephew who had done rightly by his father, would do rightly by them; for they know, as well as he does, as well as all the world must know, that he ought to pay this visit to his father; and while meanly exerting their power to delay it, are in their hearts not thinking the better of him for submitting to their whims. Respect for right conduct is felt by every body. If he would act in this sort of manner, on principle, consistently, regularly, their little minds would bend to his.",Mr. Knightley,Emma,NO MONOLOGUE,0,18,Implicit,,0.1759433113826011,0.7749773018407897
711,711,711,712,NO APPEND,"I rather doubt that. You are very fond of bending little minds; but where little minds belong to rich people in authority, I think they have a knack of swelling out, till they are quite as unmanageable as great ones. I can imagine, that if you, as you are, Mr. Knightley, were to be transported and placed all at once in Mr. Frank Churchill's situation, you would be able to say and do just what you have been recommending for him; and it might have a very good effect. The Churchills might not have a word to say in return; but then, you would have no habits of early obedience and long observance to break through. To him who has, it might not be so easy to burst forth at once into perfect independence, and set all their claims on his gratitude and regard at nought. He may have as strong a sense of what would be right, as you can have, without being so equal, under particular circumstances, to act up to it.",Emma,Mr. Knightley,NO MONOLOGUE,0,18,Implicit,,0.3582617335250521,0.8641864628053214
712,712,712,713,NO APPEND,"Then it would not be so strong a sense. If it failed to produce equal exertion, it could not be an equal conviction.",Emma,Mr. Knightley,NO MONOLOGUE,0,18,Implicit,,0.3680233343366388,0.0575246470396634
