,Unnamed: 0.1,Unnamed: 0,paragraph,append,dialogue,speaker,addressee,subject,sentiment,chapter,syntactic,referringExpression,probability_sp,probability_ad
1773,1773,1773,1774,NO APPEND,But you may come again in the cool of to-morrow morning.,Emma,Mr. Frank Churchill,NO MONOLOGUE,0,42,Implicit,,0.4200525383720224,0.0237328901681927
1774,1774,1774,1775,NO APPEND,"No--It will not be worth while. If I come, I shall be cross.",Emma,Mr. Frank Churchill,NO MONOLOGUE,0,42,Implicit,,0.4271244170450302,0.0237328901681927
1775,1775,1775,1776,NO APPEND,Then pray stay at Richmond.,Emma,Mr. Frank Churchill,NO MONOLOGUE,0,42,Implicit,,0.4274861583727561,0.0237328901681927
1776,1776,1776,1777,NO APPEND,"But if I do, I shall be crosser still. I can never bear to think of you all there without me.",Emma,Mr. Frank Churchill,NO MONOLOGUE,0,42,Implicit,,0.267157649035482,0.0237328901681927
1777,1777,1777,1778,NO APPEND,These are difficulties which you must settle for yourself. Chuse your own degree of crossness. I shall press you no more.,Emma,Mr. Frank Churchill,NO MONOLOGUE,0,42,Implicit,,0.2669121599981338,0.0237328901681927
1779,1779,1779,1780,NO APPEND,"Well;--if _you_ wish me to stay and join the party, I will.",Mr. Frank Churchill,Emma,NO MONOLOGUE,0,42,Anaphoric,his last words to Emma were,0.1989590011107058,0.2197898941148807
1795,1795,1795,1796,NO APPEND,"Your gallantry is really unanswerable. But (lowering her voice)--nobody speaks except ourselves, and it is rather too much to be talking nonsense for the entertainment of seven silent people.",Emma,Mr. Knightley,NO MONOLOGUE,0,43,Implicit,,0.2662990653401222,0.1005336632183411
1800,1800,1800,1801," cried Mrs. Elton emphatically, ","It is a sort of thing, /newquote which _I_ should not have thought myself privileged to inquire into. Though, perhaps, as the _Chaperon_ of the party--_I_ never was in any circle--exploring parties--young ladies--married women--",Mrs. Elton,Emma,NO MONOLOGUE,0,43,Explicit,cried Mrs Elton,0.9936262319315772,0.3934863834374512
1802,1802,1802,1803,NO APPEND,"Very true, my love, very true. Exactly so, indeed--quite unheard of--but some ladies say any thing. Better pass it off as a joke. Every body knows what is due to _you_.",Mr. Knightley,Emma,NO MONOLOGUE,0,43,Anaphoric,he murmured,0.3349243820033091,0.2197898941148807
1836,1836,1836,1837,NO APPEND,"Emma, I must once more speak to you as I have been used to do: a privilege rather endured than allowed, perhaps, but I must still use it. I cannot see you acting wrong, without a remonstrance. How could you be so unfeeling to Miss Bates? How could you be so insolent in your wit to a woman of her character, age, and situation?--Emma, I had not thought it possible.",Mr. Knightley,Emma,NO MONOLOGUE,0,43,Anaphoric,He looked around as if to see that no one were near and then said,0.2754515298922463,0.3783590866006683
1838,1838,1838,1839,NO APPEND,"Nay, how could I help saying what I did?--Nobody could have helped it. It was not so very bad. I dare say she did not understand me.",Emma,Mrs. Elton,NO MONOLOGUE,0,43,Implicit,,0.4176153548005674,0.0822619231872565
1839,1839,1839,1840,NO APPEND,"I assure you she did. She felt your full meaning. She has talked of it since. I wish you could have heard how she talked of it--with what candour and generosity. I wish you could have heard her honouring your forbearance, in being able to pay her such attentions, as she was for ever receiving from yourself and your father, when her society must be so irksome.",Emma,Mrs. Elton,NO MONOLOGUE,0,43,Implicit,,0.4238696213019384,0.0822619231872565
1840,1840,1840,1841," cried Emma, ","Oh! /newquote I know there is not a better creature in the world: but you must allow, that what is good and what is ridiculous are most unfortunately blended in her.",Emma,Mr. Knightley,NO MONOLOGUE,0,43,Explicit,cried Emma,0.995283421637663,0.2651509879595427
1841,1841,1841,1842," said he, ","They are blended, /newquote I acknowledge; and, were she prosperous, I could allow much for the occasional prevalence of the ridiculous over the good. Were she a woman of fortune, I would leave every harmless absurdity to take its chance, I would not quarrel with you for any liberties of manner. Were she your equal in situation--but, Emma, consider how far this is from being the case. She is poor; she has sunk from the comforts she was born to; and, if she live to old age, must probably sink more. Her situation should secure your compassion. It was badly done, indeed! You, whom she had known from an infant, whom she had seen grow up from a period when her notice was an honour, to have you now, in thoughtless spirits, and the pride of the moment, laugh at her, humble her--and before her niece, too--and before others, many of whom (certainly _some_,) would be entirely guided by _your_ treatment of her.--This is not pleasant to you, Emma--and it is very far from pleasant to me; but I must, I will,--I will tell you truths while I can; satisfied with proving myself your friend by very faithful counsel, and trusting that you will some time or other do me greater justice than you can do now.",Mr. Knightley,Emma,NO MONOLOGUE,0,43,Anaphoric,said he,0.2698276065482597,0.5620789127824175
1844,1844,1844,1845,"The wretchedness of a scheme to Box Hill was in Emma's thoughts all the evening. How it might be considered by the rest of the party, she could not tell. They, in their different homes, and their different ways, might be looking back on it with pleasure; but in her view it was a morning more completely misspent, more totally bare of rational satisfaction at the time, and more to be abhorred in recollection, than any she had ever passed. A whole evening of back-gammon with her father, was felicity to it. _There_, indeed, lay real pleasure, for there she was giving up the sweetest hours of the twenty-four to his comfort; and feeling that, unmerited as might be the degree of his fond affection and confiding esteem, she could not, in her general conduct, be open to any severe reproach. As a daughter, she hoped she was not without a heart. She hoped no one could have said to her,  /newquote  Miss Bates should never again--no, never! If attention, in future, could do away the past, she might hope to be forgiven. She had been often remiss, her conscience told her so; remiss, perhaps, more in thought than fact; scornful, ungracious. But it should be so no more. In the warmth of true contrition, she would call upon her the very next morning, and it should be the beginning, on her side, of a regular, equal, kindly intercourse.","How could you be so unfeeling to your father?--I must, I will tell you truths while I can.",Mr. Knightley,Emma,NO MONOLOGUE,0,44,Anaphoric,said he,0.3764111861639551,0.1813788661937603
1847,1847,1847,1848,"There was a bustle on her approach; a good deal of moving and talking. She heard Miss Bates's voice, something was to be done in a hurry; the maid looked frightened and awkward; hoped she would be pleased to wait a moment, and then ushered her in too soon. The aunt and niece seemed both escaping into the adjoining room. Jane she had a distinct glimpse of, looking extremely ill; and, before the door had shut them out, she heard Miss Bates saying, ","Well, my dear, I shall _say_ you are laid down upon the bed, and I am sure you are ill enough.",Miss Bates,Emma,NO MONOLOGUE,0,44,Explicit,Miss Bates saying,0.9861302036299774,0.3568501589159585
1849,1849,1849,1850," said she, ","I am afraid Jane is not very well, /newquote but I do not know; they _tell_ me she is well. I dare say my daughter will be here presently, Miss Woodhouse. I hope you find a chair. I wish Hetty had not gone. I am very little able--Have you a chair, ma'am? Do you sit where you like? I am sure she will be here presently.",Miss Bates,Emma,NO MONOLOGUE,0,44,Anaphoric,said she,0.1916119722597082,0.5493792986998453
1854,1854,1854,1855,"There was no bearing such an  /newquote  and to break through her dreadful gratitude, Emma made the direct inquiry of--",always;,Mr. Knightley,Emma,NO MONOLOGUE,0,44,Anaphoric,he had said,0.3694160992268701,0.3030052282762584
1894,1894,1894,1895,NO APPEND,"Miss Fairfax's compliments and thanks, but is quite unequal to any exercise.",Emma,Mr. Knightley,NO MONOLOGUE,0,45,Implicit,,0.4101974168940363,0.0772731531148668
1899,1899,1899,1900,"One morning, about ten days after Mrs. Churchill's decease, Emma was called downstairs to Mr. Weston, who  /newquote --He met her at the parlour-door, and hardly asking her how she did, in the natural key of his voice, sunk it immediately, to say, unheard by her father,","could not stay five minutes, and wanted particularly to speak with her.",Mr. Frank Churchill,Emma,NO MONOLOGUE,0,46,Anaphoric,said he,0.3073010158820276,0.332647886055708
1900,1900,1900,1901,NO APPEND,"Can you come to Randalls at any time this morning?--Do, if it be possible. Mrs. Weston wants to see you. She must see you.",Emma,Mr. Frank Churchill,NO MONOLOGUE,0,46,Anaphoric,He met her at the parlourdoor and hardly asking her how she did in the natural key of his voice sunk it immediately to say,0.6111919255288538,0.1966650794773212
1901,1901,1901,1902,NO APPEND,Is she unwell?,Emma,Harriet Smith,NO MONOLOGUE,0,46,Implicit,,0.4203126288608389,0.0857659668829511
1902,1902,1902,1903,NO APPEND,"No, no, not at all--only a little agitated. She would have ordered the carriage, and come to you, but she must see you _alone_, and that you know--(nodding towards her father)--Humph!--Can you come?",Emma,Jane Fairfax,NO MONOLOGUE,0,46,Implicit,,0.4095852776537289,0.0445960763512666
1903,1903,1903,1904,NO APPEND,"Certainly. This moment, if you please. It is impossible to refuse what you ask in such a way. But what can be the matter?--Is she really not ill?",Emma,Mrs. Elton,NO MONOLOGUE,0,46,Implicit,,0.4219164319201995,0.0554812633062903
1904,1904,1904,1905,NO APPEND,"Depend upon me--but ask no more questions. You will know it all in time. The most unaccountable business! But hush, hush!",Emma,Mrs. Elton,NO MONOLOGUE,0,46,Implicit,,0.4232369110495072,0.057355997172016
1906,1906,1906,1907,"--said Emma, when they were fairly beyond the sweep gates,--","Now, /newquote now Mr. Weston, do let me know what has happened.",Emma,Mr. Knightley,NO MONOLOGUE,0,46,Explicit,said Emma,0.995073662500698,0.298187355677258
1907,1907,1907,1908,--he gravely replied.--,"No, no, /newquote Don't ask me. I promised my wife to leave it all to her. She will break it to you better than I can. Do not be impatient, Emma; it will all come out too soon.",Mr. Knightley,Emma,NO MONOLOGUE,0,46,Anaphoric,he gravely replied,0.3651509069518853,0.7408268712573594
1908,1908,1908,1909," cried Emma, standing still with terror.--","Break it to me, /newquote Good God!--Mr. Weston, tell me at once.--Something has happened in Brunswick Square. I know it has. Tell me, I charge you tell me this moment what it is.",Emma,Mr. Weston,NO MONOLOGUE,0,46,Explicit,cried Emma,0.995097068223278,0.135299054532013
1909,1909,1909,1910,--,"No, indeed you are mistaken.",Emma,Mrs. Weston,NO MONOLOGUE,0,46,Implicit,,0.3952643788013621,0.0466794410655241
1910,1910,1910,1911,NO APPEND,"Mr. Weston do not trifle with me.--Consider how many of my dearest friends are now in Brunswick Square. Which of them is it?--I charge you by all that is sacred, not to attempt concealment.",Emma,Mr. Frank Churchill,NO MONOLOGUE,0,46,Implicit,,0.401530197237015,0.0646874773048023
1911,1911,1911,1912,--,"Upon my word, Emma.",Mr. Frank Churchill,Emma,NO MONOLOGUE,0,46,Implicit,,0.0620091467081761,0.7437344930030763
1912,1912,1912,1913,NO APPEND,"Your word!--why not your honour!--why not say upon your honour, that it has nothing to do with any of them? Good Heavens!--What can be to be _broke_ to me, that does not relate to one of that family?",Emma,Mr. Frank Churchill,NO MONOLOGUE,0,46,Implicit,,0.4115729093094391,0.3074828313305235
1913,1913,1913,1914," said he very seriously, ","Upon my honour, /newquote it does not. It is not in the smallest degree connected with any human being of the name of Knightley.",Mr. Frank Churchill,Emma,NO MONOLOGUE,0,46,Anaphoric,said he,0.099842408664017,0.3556882091475789
1915,1915,1915,1916," he continued, ","I was wrong, /newquote in talking of its being _broke_ to you. I should not have used the expression. In fact, it does not concern you--it concerns only myself,--that is, we hope.--Humph!--In short, my dear Emma, there is no occasion to be so uneasy about it. I don't say that it is not a disagreeable business--but things might be much worse.--If we walk fast, we shall soon be at Randalls.",Mr. Knightley,Emma,NO MONOLOGUE,0,46,Anaphoric,he continued,0.3078921814219675,0.3560910023982087
1917,1917,1917,1918," said she, as they proceeded--speaking more to assist Mr. Weston in keeping his secret, than with any other view.",Who is that gentleman on horseback?,Emma,Mr. Knightley,NO MONOLOGUE,0,46,Anaphoric,said she,0.6146448604123792,0.0716445743890561
1918,1918,1918,1919,NO APPEND,"I do not know.--One of the Otways.--Not Frank;--it is not Frank, I assure you. You will not see him. He is half way to Windsor by this time.",Emma,Mr. Knightley,NO MONOLOGUE,0,46,Implicit,,0.4198053115730501,0.0761159474971325
1919,1919,1919,1920,NO APPEND,"Has your son been with you, then?",Emma,Mr. Knightley,NO MONOLOGUE,0,46,Implicit,,0.4188582505112065,0.0772731531148668
1920,1920,1920,1921,NO APPEND,"Oh! yes--did not you know?--Well, well, never mind.",Emma,Mr. Knightley,NO MONOLOGUE,0,46,Implicit,,0.4213232076086916,0.0784464581253004
1922,1922,1922,1923,NO APPEND,"Yes, Frank came over this morning, just to ask us how we did.",Mr. Knightley,Emma,NO MONOLOGUE,0,46,Anaphoric,he was silent and then added,0.3817337632998234,0.1821323526147111
1925,1925,1925,1926,NO APPEND,"What is it my dear friend? Something of a very unpleasant nature, I find, has occurred;--do let me know directly what it is. I have been walking all this way in complete suspense. We both abhor suspense. Do not let mine continue longer. It will do you good to speak of your distress, whatever it may be.",Emma,Mrs. Weston,NO MONOLOGUE,0,46,Anaphoric,she eagerly said,0.612161259249652,0.2416236025501824
1926,1926,1926,1927, said Mrs. Weston in a trembling voice. ,"Have you indeed no idea? /newquote Cannot you, my dear Emma--cannot you form a guess as to what you are to hear?",Mrs. Weston,Emma,NO MONOLOGUE,0,46,Explicit,said Mrs Weston,0.9549132279520214,0.5414067494371455
1927,1927,1927,1928,NO APPEND,"So far as that it relates to Mr. Frank Churchill, I do guess.",Emma,Mrs. Weston,NO MONOLOGUE,0,46,Implicit,,0.4019768540442522,0.2196108243108548
1928,1928,1928,1929,"  (resuming her work, and seeming resolved against looking up.) ","You are right. It does relate to him, and I will tell you directly; /newquote He has been here this very morning, on a most extraordinary errand. It is impossible to express our surprize. He came to speak to his father on a subject,--to announce an attachment--",Emma,Mrs. Weston,NO MONOLOGUE,0,46,Implicit,,0.4093335005681138,0.0305640288345309
1930,1930,1930,1931, resumed Mrs. Weston; ,"More than an attachment, indeed, /newquote an engagement--a positive engagement.--What will you say, Emma--what will any body say, when it is known that Frank Churchill and Miss Fairfax are engaged;--nay, that they have been long engaged!",Mrs. Weston,Emma,NO MONOLOGUE,0,46,Explicit,resumed Mrs Weston,0.9637040737497125,0.3514579095966231
1932,1932,1932,1933,NO APPEND,Jane Fairfax!--Good God! You are not serious? You do not mean it?,Emma,Mrs. Weston,NO MONOLOGUE,0,46,Explicit,Emma even jumped with surprizeand horrorstruck exclaimed,0.995191914100208,0.315815916113389
1933,1933,1933,1934," returned Mrs. Weston, still averting her eyes, and talking on with eagerness, that Emma might have time to recover-- ","You may well be amazed, /newquote You may well be amazed. But it is even so. There has been a solemn engagement between them ever since October--formed at Weymouth, and kept a secret from every body. Not a creature knowing it but themselves--neither the Campbells, nor her family, nor his.--It is so wonderful, that though perfectly convinced of the fact, it is yet almost incredible to myself. I can hardly believe it.--I thought I knew him.",Mrs. Weston,Emma,NO MONOLOGUE,0,46,Explicit,returned Mrs Weston,0.9750066776693272,0.3615147112888536
1935,1935,1935,1936," said she at last, trying to recover herself; ","Well, /newquote this is a circumstance which I must think of at least half a day, before I can at all comprehend it. What!--engaged to her all the winter--before either of them came to Highbury?",Emma,Harriet Smith,NO MONOLOGUE,0,46,Anaphoric,said she,0.6207654314205052,0.3139395290565206
1936,1936,1936,1937,NO APPEND,"Engaged since October,--secretly engaged.--It has hurt me, Emma, very much. It has hurt his father equally. _Some_ _part_ of his conduct we cannot excuse.",Harriet Smith,Emma,NO MONOLOGUE,0,46,Implicit,,0.2679395952170512,0.7504353156028108
1937,1937,1937,1938,"Emma pondered a moment, and then replied, ","I will not pretend _not_ to understand you; and to give you all the relief in my power, be assured that no such effect has followed his attentions to me, as you are apprehensive of.",Emma,Harriet Smith,NO MONOLOGUE,0,46,Explicit,Emma pondered a moment and then replied,0.995176562911798,0.3569614418740015
1939,1939,1939,1940," she continued, ","That you may have less difficulty in believing this boast, of my present perfect indifference, /newquote I will farther tell you, that there was a period in the early part of our acquaintance, when I did like him, when I was very much disposed to be attached to him--nay, was attached--and how it came to cease, is perhaps the wonder. Fortunately, however, it did cease. I have really for some time past, for at least these three months, cared nothing about him. You may believe me, Mrs. Weston. This is the simple truth.",Emma,Mrs. Weston,NO MONOLOGUE,0,46,Anaphoric,she continued,0.6255657829411893,0.2336208276622225
1941,1941,1941,1942, said she. ,"Mr. Weston will be almost as much relieved as myself, /newquote On this point we have been wretched. It was our darling wish that you might be attached to each other--and we were persuaded that it was so.-- Imagine what we have been feeling on your account.",Emma,Harriet Smith,NO MONOLOGUE,0,46,Anaphoric,said she,0.6224260249185094,0.0656936257065403
1942,1942,1942,1943,NO APPEND,"I have escaped; and that I should escape, may be a matter of grateful wonder to you and myself. But this does not acquit _him_, Mrs. Weston; and I must say, that I think him greatly to blame. What right had he to come among us with affection and faith engaged, and with manners so _very_ disengaged? What right had he to endeavour to please, as he certainly did--to distinguish any one young woman with persevering attention, as he certainly did--while he really belonged to another?--How could he tell what mischief he might be doing?--How could he tell that he might not be making me in love with him?--very wrong, very wrong indeed.",Emma,Harriet Smith,NO MONOLOGUE,0,46,Implicit,,0.4373560205824252,0.2810941444411862
1943,1943,1943,1944,NO APPEND,"From something that he said, my dear Emma, I rather imagine--",Harriet Smith,Emma,NO MONOLOGUE,0,46,Implicit,,0.2852285093612933,0.7532710425767961
1944,1944,1944,1945,NO APPEND,"And how could _she_ bear such behaviour! Composure with a witness! to look on, while repeated attentions were offering to another woman, before her face, and not resent it.--That is a degree of placidity, which I can neither comprehend nor respect.",Emma,Mrs. Weston,NO MONOLOGUE,0,46,Implicit,,0.4188071008457987,0.3259135698270998
1945,1945,1945,1946,NO APPEND,"There were misunderstandings between them, Emma; he said so expressly. He had not time to enter into much explanation. He was here only a quarter of an hour, and in a state of agitation which did not allow the full use even of the time he could stay--but that there had been misunderstandings he decidedly said. The present crisis, indeed, seemed to be brought on by them; and those misunderstandings might very possibly arise from the impropriety of his conduct.",Mrs. Weston,Emma,NO MONOLOGUE,0,46,Implicit,,0.1132833174634002,0.7542114555861497
1946,1946,1946,1947,NO APPEND,"Impropriety! Oh! Mrs. Weston--it is too calm a censure. Much, much beyond impropriety!--It has sunk him, I cannot say how it has sunk him in my opinion. So unlike what a man should be!--None of that upright integrity, that strict adherence to truth and principle, that disdain of trick and littleness, which a man should display in every transaction of his life.",Emma,Mrs. Weston,NO MONOLOGUE,0,46,Implicit,,0.4258765709189736,0.8321934326373621
1947,1947,1947,1948,NO APPEND,"Nay, dear Emma, now I must take his part; for though he has been wrong in this instance, I have known him long enough to answer for his having many, very many, good qualities; and--",Mrs. Weston,Emma,NO MONOLOGUE,0,46,Implicit,,0.1241898627501734,0.7551494493000619
1948,1948,1948,1949," cried Emma, not attending to her.--","Good God! /newquote Mrs. Smallridge, too! Jane actually on the point of going as governess! What could he mean by such horrible indelicacy? To suffer her to engage herself--to suffer her even to think of such a measure!",Emma,Mrs. Weston,NO MONOLOGUE,0,46,Explicit,cried Emma,0.9943569319717052,0.8447410503027503
1949,1949,1949,1950,NO APPEND,"He knew nothing about it, Emma. On this article I can fully acquit him. It was a private resolution of hers, not communicated to him--or at least not communicated in a way to carry conviction.--Till yesterday, I know he said he was in the dark as to her plans. They burst on him, I do not know how, but by some letter or message--and it was the discovery of what she was doing, of this very project of hers, which determined him to come forward at once, own it all to his uncle, throw himself on his kindness, and, in short, put an end to the miserable state of concealment that had been carrying on so long.",Mrs. Weston,Emma,NO MONOLOGUE,0,46,Implicit,,0.1319810344033608,0.5695467924531733
1951,1951,1951,1952, continued Mrs. Weston. ,"I am to hear from him soon, /newquote He told me at parting, that he should soon write; and he spoke in a manner which seemed to promise me many particulars that could not be given now. Let us wait, therefore, for this letter. It may bring many extenuations. It may make many things intelligible and excusable which now are not to be understood. Don't let us be severe, don't let us be in a hurry to condemn him. Let us have patience. I must love him; and now that I am satisfied on one point, the one material point, I am sincerely anxious for its all turning out well, and ready to hope that it may. They must both have suffered a great deal under such a system of secresy and concealment.",Mrs. Weston,Emma,NO MONOLOGUE,0,46,Explicit,continued Mrs Weston,0.9750258950777536,0.3237119525802633
1952,1952,1952,1953," replied Emma dryly, ","_His_ sufferings, /newquote do not appear to have done him much harm. Well, and how did Mr. Churchill take it?",Emma,Mrs. Weston,NO MONOLOGUE,0,46,Explicit,replied Emma,0.9952543999829576,0.2401089571412756
1953,1953,1953,1954,NO APPEND,"Most favourably for his nephew--gave his consent with scarcely a difficulty. Conceive what the events of a week have done in that family! While poor Mrs. Churchill lived, I suppose there could not have been a hope, a chance, a possibility;--but scarcely are her remains at rest in the family vault, than her husband is persuaded to act exactly opposite to what she would have required. What a blessing it is, when undue influence does not survive the grave!--He gave his consent with very little persuasion.",Emma,Mrs. Weston,NO MONOLOGUE,0,46,Implicit,,0.4199565701826633,0.0349633249174747
1955,1955,1955,1956,NO APPEND,"This was settled last night, and Frank was off with the light this morning. He stopped at Highbury, at the Bates's, I fancy, some time--and then came on hither; but was in such a hurry to get back to his uncle, to whom he is just now more necessary than ever, that, as I tell you, he could stay with us but a quarter of an hour.--He was very much agitated--very much, indeed--to a degree that made him appear quite a different creature from any thing I had ever seen him before.--In addition to all the rest, there had been the shock of finding her so very unwell, which he had had no previous suspicion of--and there was every appearance of his having been feeling a great deal.",Emma,Mrs. Weston,NO MONOLOGUE,0,46,Implicit,,0.4207051591695299,0.0417863567203012
1956,1956,1956,1957,NO APPEND,"And do you really believe the affair to have been carrying on with such perfect secresy?--The Campbells, the Dixons, did none of them know of the engagement?",Emma,Jane Fairfax,NO MONOLOGUE,0,46,Implicit,,0.4163269859917961,0.0397425831533891
1958,1958,1958,1959,NO APPEND,None; not one. He positively said that it had been known to no being in the world but their two selves.,Emma,Harriet Smith,NO MONOLOGUE,0,46,Implicit,,0.4011611034363301,0.0420221162756203
