,Unnamed: 0.1,Unnamed: 0,paragraph,append,dialogue,speaker,addressee,subject,sentiment,chapter,syntactic,referringExpression,probability_sp,probability_ad
1365,1365,1365,1366,--,"You appear to feel a great deal--but I am not aware how you or any of Miss Fairfax's acquaintance here, any of those who have known her longer than yourself, can shew her any other attention than",Emma,Mrs. Elton,NO MONOLOGUE,0,33,Implicit,,0.4164751713416543,0.8582420319756103
1366,1366,1366,1367,NO APPEND,"My dear Miss Woodhouse, a vast deal may be done by those who dare to act. You and I need not be afraid. If _we_ set the example, many will follow it as far as they can; though all have not our situations. _We_ have carriages to fetch and convey her home, and _we_ live in a style which could not make the addition of Jane Fairfax, at any time, the least inconvenient.--I should be extremely displeased if Wright were to send us up such a dinner, as could make me regret having asked _more_ than Jane Fairfax to partake of it. I have no idea of that sort of thing. It is not likely that I _should_, considering what I have been used to. My greatest danger, perhaps, in housekeeping, may be quite the other way, in doing too much, and being too careless of expense. Maple Grove will probably be my model more than it ought to be--for we do not at all affect to equal my brother, Mr. Suckling, in income.--However, my resolution is taken as to noticing Jane Fairfax.--I shall certainly have her very often at my house, shall introduce her wherever I can, shall have musical parties to draw out her talents, and shall be constantly on the watch for an eligible situation. My acquaintance is so very extensive, that I have little doubt of hearing of something to suit her shortly.--I shall introduce her, of course, very particularly to my brother and sister when they come to us. I am sure they will like her extremely; and when she gets a little acquainted with them, her fears will completely wear off, for there really is nothing in the manners of either but what is highly conciliating.--I shall have her very often indeed while they are with me, and I dare say we shall sometimes find a seat for her in the barouche-landau in some of our exploring parties.",Mrs. Elton,Emma,NO MONOLOGUE,0,33,Implicit,,0.7025201341230165,0.6233811005872089
1367,1367,1367,1368,--thought Emma.--,"Poor Jane Fairfax! /newquote You have not deserved this. You may have done wrong with regard to Mr. Dixon, but this is a punishment beyond what you can have merited!--The kindness and protection of Mrs. Elton!--'Jane Fairfax and Jane Fairfax.' Heavens! Let me not suppose that she dares go about, Emma Woodhouse-ing me!--But upon my honour, there seems no limits to the licentiousness of that woman's tongue!",Harriet Smith,Mrs. Elton,NO MONOLOGUE,0,33,Implicit,,0.3072050915408088,0.7889934631924926
1398,1398,1398,1399," said Emma triumphantly when he left them, ","Well, Mrs. Weston, /newquote what do you say now to Mr. Knightley's marrying Jane Fairfax?",Emma,Mr. Knightley,NO MONOLOGUE,0,33,Explicit,said Emma,0.9945492586545008,0.8112981076077515
1399,1399,1399,1400,NO APPEND,"Why, really, dear Emma, I say that he is so very much occupied by the idea of _not_ being in love with her, that I should not wonder if it were to end in his being so at last. Do not beat me.",Mr. Knightley,Emma,NO MONOLOGUE,0,33,Implicit,,0.2237379063938629,0.6144697717960366
1404,1404,1404,1405,"The persons to be invited, required little thought. Besides the Eltons, it must be the Westons and Mr. Knightley; so far it was all of course--and it was hardly less inevitable that poor little Harriet must be asked to make the eighth:--but this invitation was not given with equal satisfaction, and on many accounts Emma was particularly pleased by Harriet's begging to be allowed to decline it.  /newquote  It was precisely what Emma would have wished, had she deemed it possible enough for wishing. She was delighted with the fortitude of her little friend--for fortitude she knew it was in her to give up being in company and stay at home; and she could now invite the very person whom she really wanted to make the eighth, Jane Fairfax.-- Since her last conversation with Mrs. Weston and Mr. Knightley, she was more conscience-stricken about Jane Fairfax than she had often been.--Mr. Knightley's words dwelt with her. He had said that Jane Fairfax received attentions from Mrs. Elton which nobody else paid her.","She would rather not be in his company more than she could help. She was not yet quite able to see him and his charming happy wife together, without feeling uncomfortable. If Miss Woodhouse would not be displeased, she would rather stay at home.",Harriet Smith,Emma,NO MONOLOGUE,0,34,Explicit,Harriet unchecked ran eagerly through what she had to tell,0.9847896429759808,0.3785652366579612
1410,1410,1410,1411,NO APPEND,"I hope you did not venture far, Miss Fairfax, this morning, or I am sure you must have been wet.--We scarcely got home in time. I hope you turned directly.",Mr. Knightley,Emma,NO MONOLOGUE,0,34,Anaphoric,he said,0.2883553597584671,0.3795312386774078
1411,1411,1411,1412," said she, ","I went only to the post-office, /newquote and reached home before the rain was much. It is my daily errand. I always fetch the letters when I am here. It saves trouble, and is a something to get me out. A walk before breakfast does me good.",Emma,Mr. Knightley,NO MONOLOGUE,0,34,Anaphoric,said she,0.6316503740864242,0.3520590775588217
1412,1412,1412,1413,NO APPEND,"Not a walk in the rain, I should imagine.",Emma,Mr. Knightley,NO MONOLOGUE,0,34,Implicit,,0.4293772755915311,0.0827693184329707
1413,1413,1413,1414,NO APPEND,"No, but it did not absolutely rain when I set out.",Emma,Mr. Knightley,NO MONOLOGUE,0,34,Implicit,,0.429507202618331,0.0922150586996744
1415,1415,1415,1416,NO APPEND,"That is to say, you chose to have your walk, for you were not six yards from your own door when I had the pleasure of meeting you; and Henry and John had seen more drops than they could count long before. The post-office has a great charm at one period of our lives. When you have lived to my age, you will begin to think letters are never worth going through the rain for.",Mr. John Knightley,Emma,NO MONOLOGUE,0,34,Explicit,Mr John Knightley smiled and replied,0.9974265562118736,0.2104234175713472
1417,1417,1417,1418,NO APPEND,"I must not hope to be ever situated as you are, in the midst of every dearest connexion, and therefore I cannot expect that simply growing older should make me indifferent about letters.",Emma,Mr. Knightley,NO MONOLOGUE,0,34,Implicit,,0.4345214944470415,0.0880536867787977
1418,1418,1418,1419,NO APPEND,Indifferent! Oh! no--I never conceived you could become indifferent. Letters are no matter of indifference; they are generally a very positive curse.,Emma,Mr. Knightley,NO MONOLOGUE,0,34,Implicit,,0.3363324792418835,0.0840627146373906
1419,1419,1419,1420,NO APPEND,You are speaking of letters of business; mine are letters of friendship.,Emma,Mr. Knightley,NO MONOLOGUE,0,34,Implicit,,0.3353205745242975,0.3411321874347361
1420,1420,1420,1421, replied he coolly. ,"I have often thought them the worst of the two, /newquote Business, you know, may bring money, but friendship hardly ever does.",Mr. Knightley,Emma,NO MONOLOGUE,0,34,Anaphoric,replied he,0.3412823686433939,0.5946088987302973
1421,1421,1421,1422,NO APPEND,"Ah! you are not serious now. I know Mr. John Knightley too well--I am very sure he understands the value of friendship as well as any body. I can easily believe that letters are very little to you, much less than to me, but it is not your being ten years older than myself which makes the difference, it is not age, but situation. You have every body dearest to you always at hand, I, probably, never shall again; and therefore till I have outlived all my affections, a post-office, I think, must always have power to draw me out, in worse weather than to-day.",Emma,Mr. Knightley,NO MONOLOGUE,0,34,Implicit,,0.3417589462369196,0.3996318992420468
1422,1422,1422,1423,"  said John Knightley, ","When I talked of your being altered by time, by the progress of years, /newquote I meant to imply the change of situation which time usually brings. I consider one as including the other. Time will generally lessen the interest of every attachment not within the daily circle--but that is not the change I had in view for you. As an old friend, you will allow me to hope, Miss Fairfax, that ten years hence you may have as many concentrated objects as I have.",Mr. John Knightley,Emma,NO MONOLOGUE,0,34,Explicit,said John Knightley,0.996623062995651,0.5946088987302973
1424,1424,1424,1425,NO APPEND,"I am very sorry to hear, Miss Fairfax, of your being out this morning in the rain. Young ladies should take care of themselves.--Young ladies are delicate plants. They should take care of their health and their complexion. My dear, did you change your stockings?",Mr. Knightley,Emma,NO MONOLOGUE,0,34,Anaphoric,his mildest urbanity said,0.4659232239132573,0.5946088987302973
1425,1425,1425,1426,NO APPEND,"Yes, sir, I did indeed; and I am very much obliged by your kind solicitude about me.",Emma,Mr. Knightley,NO MONOLOGUE,0,34,Implicit,,0.3354781747561449,0.3443803509833037
1426,1426,1426,1427,NO APPEND,"My dear Miss Fairfax, young ladies are very sure to be cared for.--I hope your good grand-mama and aunt are well. They are some of my very old friends. I wish my health allowed me to be a better neighbour. You do us a great deal of honour to-day, I am sure. My daughter and I are both highly sensible of your goodness, and have the greatest satisfaction in seeing you at Hartfield.",Emma,Mr. Knightley,NO MONOLOGUE,0,34,Implicit,,0.3393903976032145,0.0707997093411913
1429,1429,1429,1430,NO APPEND,"My dear Jane, what is this I hear?--Going to the post-office in the rain!--This must not be, I assure you.--You sad girl, how could you do such a thing?--It is a sign I was not there to take care of you.",Emma,Mr. Knightley,NO MONOLOGUE,0,34,Anaphoric,her remonstrances now opened upon Jane,0.5430774769166614,0.0730581018105954
1439,1439,1439,1440, said she.--,"The post-office is a wonderful establishment! /newquote The regularity and despatch of it! If one thinks of all that it has to do, and all that it does so well, it is really astonishing!",Emma,Mr. Knightley,NO MONOLOGUE,0,34,Anaphoric,said she,0.5428289207171524,0.0558180705847414
1440,1440,1440,1441,NO APPEND,It is certainly very well regulated.,Emma,Mr. Knightley,NO MONOLOGUE,0,34,Implicit,,0.3348479941062463,0.0558180705847414
1441,1441,1441,1442,NO APPEND,"So seldom that any negligence or blunder appears! So seldom that a letter, among the thousands that are constantly passing about the kingdom, is even carried wrong--and not one in a million, I suppose, actually lost! And when one considers the variety of hands, and of bad hands too, that are to be deciphered, it increases the wonder.",Emma,Mr. Knightley,NO MONOLOGUE,0,34,Implicit,,0.3387830104355497,0.2696126725871205
1442,1442,1442,1443," continued he, smiling, ","The clerks grow expert from habit.--They must begin with some quickness of sight and hand, and exercise improves them. If you want any farther explanation, /newquote they are paid for it. That is the key to a great deal of capacity. The public pays and must be served well.",Mr. Knightley,Emma,NO MONOLOGUE,0,34,Anaphoric,continued he,0.2821293482105489,0.3872872463760376
1460,1460,1460,1461," said she, ",Here is April come! /newquote I get quite anxious about you. June will soon be here.,Emma,Mr. Knightley,NO MONOLOGUE,0,35,Anaphoric,said she,0.6400682404004928,0.0853744408851083
1461,1461,1461,1462,NO APPEND,But I have never fixed on June or any other month--merely looked forward to the summer in general.,Emma,Mr. Knightley,NO MONOLOGUE,0,35,Implicit,,0.4271579516361283,0.0922150586996744
1462,1462,1462,1463,NO APPEND,But have you really heard of nothing?,Emma,Mr. Knightley,NO MONOLOGUE,0,35,Implicit,,0.4262787435215686,0.0922150586996744
1463,1463,1463,1464,NO APPEND,I have not even made any inquiry; I do not wish to make any yet.,Emma,Mr. Knightley,NO MONOLOGUE,0,35,Implicit,,0.4286949002018214,0.0908086655808012
1464,1464,1464,1465,NO APPEND,"Oh! my dear, we cannot begin too early; you are not aware of the difficulty of procuring exactly the desirable thing.",Emma,Jane Fairfax,NO MONOLOGUE,0,35,Implicit,,0.4294598646729768,0.3664539070693195
1465,1465,1465,1466," said Jane, shaking her head; ","I not aware! /newquote dear Mrs. Elton, who can have thought of it as I have done?",Jane Fairfax,Emma,NO MONOLOGUE,0,35,Explicit,said Jane,0.9954920639393064,0.610822406878763
1466,1466,1466,1467,NO APPEND,"But you have not seen so much of the world as I have. You do not know how many candidates there always are for the _first_ situations. I saw a vast deal of that in the neighbourhood round Maple Grove. A cousin of Mr. Suckling, Mrs. Bragge, had such an infinity of applications; every body was anxious to be in her family, for she moves in the first circle. Wax-candles in the schoolroom! You may imagine how desirable! Of all houses in the kingdom Mrs. Bragge's is the one I would most wish to see you in.",Emma,Jane Fairfax,NO MONOLOGUE,0,35,Implicit,,0.4381256338012574,0.9652968909724148
1467,1467,1467,1468,  said Jane. ,"Colonel and Mrs. Campbell are to be in town again by midsummer, /newquote I must spend some time with them; I am sure they will want it;--afterwards I may probably be glad to dispose of myself. But I would not wish you to take the trouble of making any inquiries at present.",Jane Fairfax,Emma,NO MONOLOGUE,0,35,Explicit,said Jane,0.9943917132195016,0.6095207702429064
1468,1468,1468,1469,NO APPEND,"Trouble! aye, I know your scruples. You are afraid of giving me trouble; but I assure you, my dear Jane, the Campbells can hardly be more interested about you than I am. I shall write to Mrs. Partridge in a day or two, and shall give her a strict charge to be on the look-out for any thing eligible.",Emma,Mrs. Weston,NO MONOLOGUE,0,35,Implicit,,0.4300582440192192,0.0478240009866225
1469,1469,1469,1470,NO APPEND,"Thank you, but I would rather you did not mention the subject to her; till the time draws nearer, I do not wish to be giving any body trouble.",Emma,Mrs. Elton,NO MONOLOGUE,0,35,Implicit,,0.3362404256561522,0.0282019790935361
1470,1470,1470,1471,NO APPEND,"But, my dear child, the time is drawing near; here is April, and June, or say even July, is very near, with such business to accomplish before us. Your inexperience really amuses me! A situation such as you deserve, and your friends would require for you, is no everyday occurrence, is not obtained at a moment's notice; indeed, indeed, we must begin inquiring directly.",Emma,Mrs. Elton,NO MONOLOGUE,0,35,Implicit,,0.3392451046616553,0.0289958699127197
1471,1471,1471,1472,NO APPEND,"Excuse me, ma'am, but this is by no means my intention; I make no inquiry myself, and should be sorry to have any made by my friends. When I am quite determined as to the time, I am not at all afraid of being long unemployed. There are places in town, offices, where inquiry would soon produce something--Offices for the sale--not quite of human flesh--but of human intellect.",Emma,Mrs. Elton,NO MONOLOGUE,0,35,Implicit,,0.3393243516056888,0.0289958699127197
1472,1472,1472,1473,NO APPEND,"Oh! my dear, human flesh! You quite shock me; if you mean a fling at the slave-trade, I assure you Mr. Suckling was always rather a friend to the abolition.",Emma,Jane Fairfax,NO MONOLOGUE,0,35,Implicit,,0.3364245452559564,0.3727196961937082
1473,1473,1473,1474, replied Jane; ,"I did not mean, I was not thinking of the slave-trade, /newquote governess-trade, I assure you, was all that I had in view; widely different certainly as to the guilt of those who carry it on; but as to the greater misery of the victims, I do not know where it lies. But I only mean to say that there are advertising offices, and that by applying to them I should have no doubt of very soon meeting with something that would do.",Jane Fairfax,Emma,NO MONOLOGUE,0,35,Explicit,replied Jane,0.9934495374825704,0.3872872463760376
1474,1474,1474,1475, repeated Mrs. Elton. ,"Something that would do! /newquote Aye, _that_ may suit your humble ideas of yourself;--I know what a modest creature you are; but it will not satisfy your friends to have you taking up with any thing that may offer, any inferior, commonplace situation, in a family not moving in a certain circle, or able to command the elegancies of life.",Mrs. Elton,Jane Fairfax,NO MONOLOGUE,0,35,Explicit,repeated Mrs Elton,0.9968315006772062,0.3798594753324376
1475,1475,1475,1476,NO APPEND,"You are very obliging; but as to all that, I am very indifferent; it would be no object to me to be with the rich; my mortifications, I think, would only be the greater; I should suffer more from comparison. A gentleman's family is all that I should condition for.",Emma,Mrs. Elton,NO MONOLOGUE,0,35,Implicit,,0.3378465635098798,0.0398639870321747
1476,1476,1476,1477,NO APPEND,"I know you, I know you; you would take up with any thing; but I shall be a little more nice, and I am sure the good Campbells will be quite on my side; with your superior talents, you have a right to move in the first circle. Your musical knowledge alone would entitle you to name your own terms, have as many rooms as you like, and mix in the family as much as you chose;--that is--I do not know--if you knew the harp, you might do all that, I am very sure; but you sing as well as play;--yes, I really believe you might, even without the harp, stipulate for what you chose;--and you must and shall be delightfully, honourably and comfortably settled before the Campbells or I have any rest.",Emma,Jane Fairfax,NO MONOLOGUE,0,35,Implicit,,0.3435106635483917,0.3790285252662936
1477,1477,1477,1478," said Jane, ","You may well class the delight, the honour, and the comfort of such a situation together, /newquote they are pretty sure to be equal; however, I am very serious in not wishing any thing to be attempted at present for me. I am exceedingly obliged to you, Mrs. Elton, I am obliged to any body who feels for me, but I am quite serious in wishing nothing to be done till the summer. For two or three months longer I shall remain where I am, and as I am.",Jane Fairfax,Emma,NO MONOLOGUE,0,35,Explicit,said Jane,0.9933094248730876,0.3872872463760376
1478,1478,1478,1479," replied Mrs. Elton gaily, ","And I am quite serious too, I assure you, /newquote in resolving to be always on the watch, and employing my friends to watch also, that nothing really unexceptionable may pass us.",Mrs. Elton,Jane Fairfax,NO MONOLOGUE,0,35,Explicit,replied Mrs Elton,0.9882876365711024,0.3188468311123278
1480,1480,1480,1481,NO APPEND,"Here comes this dear old beau of mine, I protest!--Only think of his gallantry in coming away before the other men!--what a dear creature he is;--I assure you I like him excessively. I admire all that quaint, old-fashioned politeness; it is much more to my taste than modern ease; modern ease often disgusts me. But this good old Mr. Woodhouse, I wish you had heard his gallant speeches to me at dinner. Oh! I assure you I began to think my caro sposo would be absolutely jealous. I fancy I am rather a favourite; he took notice of my gown. How do you like it?--Selina's choice--handsome, I think, but I do not know whether it is not over-trimmed; I have the greatest dislike to the idea of being over-trimmed--quite a horror of finery. I must put on a few ornaments now, because it is expected of me. A bride, you know, must appear like a bride, but my natural taste is all for simplicity; a simple style of dress is so infinitely preferable to finery. But I am quite in the minority, I believe; few people seem to value simplicity of dress,--show and finery are every thing. I have some notion of putting such a trimming as this to my white and silver poplin. Do you think it will look well?",Emma,Mr. Frank Churchill,NO MONOLOGUE,0,35,Anaphoric,her saying in the same halfwhisper to Jane,0.6097796778884532,0.0279039204976715
1489,1489,1489,1490,  said Mr. Weston.,"I hope I shall soon have the pleasure of introducing my son to you,",Mr. Weston,Emma,NO MONOLOGUE,0,36,Explicit,said Mr Weston,0.9908567494678816,0.2054664686511863
1491,1491,1491,1492, he continued--,"You have heard of a certain Frank Churchill, I presume, /newquote and know him to be my son, though he does not bear my name.",Mr. Knightley,Emma,NO MONOLOGUE,0,36,Anaphoric,he continued,0.1917651567396243,0.3796923321110332
1492,1492,1492,1493,NO APPEND,"Oh! yes, and I shall be very happy in his acquaintance. I am sure Mr. Elton will lose no time in calling on him; and we shall both have great pleasure in seeing him at the Vicarage.",Emma,Mr. Knightley,NO MONOLOGUE,0,36,Implicit,,0.4334319949513459,0.2860793352943965
1493,1493,1493,1494,NO APPEND,"You are very obliging.--Frank will be extremely happy, I am sure.-- He is to be in town next week, if not sooner. We have notice of it in a letter to-day. I met the letters in my way this morning, and seeing my son's hand, presumed to open it--though it was not directed to me--it was to Mrs. Weston. She is his principal correspondent, I assure you. I hardly ever get a letter.",Emma,Mr. Knightley,NO MONOLOGUE,0,36,Implicit,,0.4332318039952006,0.0567163544315119
1494,1494,1494,1495,NO APPEND,"And so you absolutely opened what was directed to her! Oh! Mr. Weston--(laughing affectedly) I must protest against that.--A most dangerous precedent indeed!--I beg you will not let your neighbours follow your example.--Upon my word, if this is what I am to expect, we married women must begin to exert ourselves!--Oh! Mr. Weston, I could not have believed it of you!",Emma,Mr. Weston,NO MONOLOGUE,0,36,Implicit,,0.4351070661197935,0.0863372716397856
1495,1495,1495,1496,NO APPEND,"Aye, we men are sad fellows. You must take care of yourself, Mrs. Elton.--This letter tells us--it is a short letter--written in a hurry, merely to give us notice--it tells us that they are all coming up to town directly, on Mrs. Churchill's account--she has not been well the whole winter, and thinks Enscombe too cold for her--so they are all to move southward without loss of time.",Emma,Mr. Knightley,NO MONOLOGUE,0,36,Implicit,,0.4353532683658628,0.0765702937305986
1496,1496,1496,1497,NO APPEND,"Indeed!--from Yorkshire, I think. Enscombe is in Yorkshire?",Emma,Mr. Knightley,NO MONOLOGUE,0,36,Implicit,,0.4225492955070849,0.0814940519366887
1497,1497,1497,1498,NO APPEND,"Yes, they are about one hundred and ninety miles from London, a considerable journey.",Emma,Mr. Knightley,NO MONOLOGUE,0,36,Implicit,,0.4279839474189465,0.0880536867787977
1498,1498,1498,1499,NO APPEND,"Yes, upon my word, very considerable. Sixty-five miles farther than from Maple Grove to London. But what is distance, Mr. Weston, to people of large fortune?--You would be amazed to hear how my brother, Mr. Suckling, sometimes flies about. You will hardly believe me--but twice in one week he and Mr. Bragge went to London and back again with four horses.",Emma,Mrs. Weston,NO MONOLOGUE,0,36,Implicit,,0.3390470267124662,0.0459016506728162
1499,1499,1499,1500," said Mr. Weston, ","The evil of the distance from Enscombe, /newquote is, that Mrs. Churchill, _as_ _we_ _understand_, has not been able to leave the sofa for a week together. In Frank's last letter she complained, he said, of being too weak to get into her conservatory without having both his arm and his uncle's! This, you know, speaks a great degree of weakness--but now she is so impatient to be in town, that she means to sleep only two nights on the road.--So Frank writes word. Certainly, delicate ladies have very extraordinary constitutions, Mrs. Elton. You must grant me that.",Mr. Weston,Emma,NO MONOLOGUE,0,36,Explicit,said Mr Weston,0.9935059847256416,0.5946088987302973
1500,1500,1500,1501,NO APPEND,"No, indeed, I shall grant you nothing. I always take the part of my own sex. I do indeed. I give you notice--You will find me a formidable antagonist on that point. I always stand up for women--and I assure you, if you knew how Selina feels with respect to sleeping at an inn, you would not wonder at Mrs. Churchill's making incredible exertions to avoid it. Selina says it is quite horror to her--and I believe I have caught a little of her nicety. She always travels with her own sheets; an excellent precaution. Does Mrs. Churchill do the same?",Emma,Mr. Weston,NO MONOLOGUE,0,36,Implicit,,0.341586660957598,0.1031565407874503
1501,1501,1501,1502,--,"Depend upon it, Mrs. Churchill does every thing that any other fine lady ever did. Mrs. Churchill will not be second to any lady in the land for",Emma,Mrs. Weston,NO MONOLOGUE,0,36,Implicit,,0.336266725412139,0.0519002832415049
1503,1503,1503,1504,NO APPEND,"Oh! Mr. Weston, do not mistake me. Selina is no fine lady, I assure you. Do not run away with such an idea.",Mrs. Elton,Emma,NO MONOLOGUE,0,36,Explicit,Mrs Elton eagerly interposed with,0.9954337105609178,0.3660971904020774
1504,1504,1504,1505,NO APPEND,"Is not she? Then she is no rule for Mrs. Churchill, who is as thorough a fine lady as any body ever beheld.",Emma,Mrs. Elton,NO MONOLOGUE,0,36,Implicit,,0.3357803443383809,0.0938855378917613
1506,1506,1506,1507,NO APPEND,"Mrs. Churchill is not much in my good graces, as you may suspect--but this is quite between ourselves. She is very fond of Frank, and therefore I would not speak ill of her. Besides, she is out of health now; but _that_ indeed, by her own account, she has always been. I would not say so to every body, Mrs. Elton, but I have not much faith in Mrs. Churchill's illness.",Mr. Weston,Emma,NO MONOLOGUE,0,36,Explicit,Mr Weston went on,0.9939452286135444,0.3660971904020774
