,Unnamed: 0.1,Unnamed: 0,paragraph,append,dialogue,speaker,addressee,subject,sentiment,chapter,syntactic,referringExpression,probability_sp,probability_ad
14,14,14,15, said Lord Henry languidly. ,"It is your best work, Basil, the best thing you have ever done, /newquote You must certainly send it next year to the Grosvenor. The Academy is too large and too vulgar. Whenever I have gone there, there have been either so many people that I have not been able to see the pictures, which was dreadful, or so many pictures that I have not been able to see the people, which was worse. The Grosvenor is really the only place.",Lord Henry,Basil Hallward,NO MONOLOGUE,0,1,Explicit,said Lord Henry,0.9901749686533304,0.5004336831471381
15,15,15,16," he answered, tossing his head back in that odd way that used to make his friends laugh at him at Oxford. ","I don t think I shall send it anywhere, /newquote No, I won t send it anywhere.",Basil Hallward,Lord Henry,NO MONOLOGUE,0,1,Anaphoric,he answered,0.2342952505269683,0.3046218581916583
16,16,16,17,"Lord Henry elevated his eyebrows and looked at him in amazement through the thin blue wreaths of smoke that curled up in such fanciful whorls from his heavy, opium-tainted cigarette. ","Not send it anywhere? My dear fellow, why? Have you any reason? What odd chaps you painters are! You do anything in the world to gain a reputation. As soon as you have one, you seem to want to throw it away. It is silly of you, for there is only one thing in the world worse than being talked about, and that is not being talked about. A portrait like this would set you far above all the young men in England, and make the old men quite jealous, if old men are ever capable of any emotion.",Lord Henry,Basil Hallward,NO MONOLOGUE,0,1,Implicit,,0.5120925507917833,0.2515497567780697
17,17,17,18," he replied, ","I know you will laugh at me, /newquote but I really can t exhibit it. I have put too much of myself into it.",Basil Hallward,Lord Henry,NO MONOLOGUE,0,1,Anaphoric,he replied,0.2925464731478317,0.1252353460217548
19,19,19,20,NO APPEND,"Yes, I knew you would; but it is quite true, all the same.",Lord Henry,Basil Hallward,NO MONOLOGUE,0,1,Implicit,,0.4630082342800862,0.0668189044872313
20,20,20,21,NO APPEND,"Too much of yourself in it! Upon my word, Basil, I didn t know you were so vain; and I really can t see any resemblance between you, with your rugged strong face and your coal-black hair, and this young Adonis, who looks as if he was made out of ivory and rose-leaves. Why, my dear Basil, he is a Narcissus, and you well, of course you have an intellectual expression and all that. But beauty, real beauty, ends where an intellectual expression begins. Intellect is in itself a mode of exaggeration, and destroys the harmony of any face. The moment one sits down to think, one becomes all nose, or all forehead, or something horrid. Look at the successful men in any of the learned professions. How perfectly hideous they are! Except, of course, in the Church. But then in the Church they don t think. A bishop keeps on saying at the age of eighty what he was told to say when he was a boy of eighteen, and as a natural consequence he always looks absolutely delightful. Your mysterious young friend, whose name you have never told me, but whose picture really fascinates me, never thinks. I feel quite sure of that. He is some brainless beautiful creature who should be always here in winter when we have no flowers to look at, and always here in summer when we want something to chill our intelligence. Don t flatter yourself, Basil: you are not in the least like him.",Lord Henry,Basil Hallward,NO MONOLOGUE,0,1,Implicit,,0.7403566799509538,0.5648818216576171
21,21,21,22, answered the artist. ,"You don t understand me, Harry, /newquote Of course I am not like him. I know that perfectly well. Indeed, I should be sorry to look like him. You shrug your shoulders? I am telling you the truth. There is a fatality about all physical and intellectual distinction, the sort of fatality that seems to dog through history the faltering steps of kings. It is better not to be different from one s fellows. The ugly and the stupid have the best of it in this world. They can sit at their ease and gape at the play. If they know nothing of victory, they are at least spared the knowledge of defeat. They live as we all should live undisturbed, indifferent, and without disquiet. They neither bring ruin upon others, nor ever receive it from alien hands. Your rank and wealth, Harry; my brains, such as they are my art, whatever it may be worth; Dorian Gray s good looks we shall all suffer for what the gods have given us, suffer terribly.",Basil Hallward,Lord Henry,NO MONOLOGUE,0,1,Anaphoric,answered the artist,0.5506151412445675,0.6921681161768853
22,22,22,23," asked Lord Henry, walking across the studio towards Basil Hallward.",Dorian Gray? Is that his name?,Lord Henry,Basil Hallward,NO MONOLOGUE,0,1,Explicit,asked Lord Henry,0.9900743521769286,0.1519625260876146
23,23,23,24,NO APPEND,"Yes, that is his name. I didn t intend to tell it to you.",Lord Henry,Basil Hallward,NO MONOLOGUE,0,1,Implicit,,0.5230484020841906,0.0849163289919887
24,24,24,25,NO APPEND,But why not?,Lord Henry,Basil Hallward,NO MONOLOGUE,0,1,Implicit,,0.4914324860964791,0.0724135971203889
25,25,25,26,NO APPEND,"Oh, I can t explain. When I like people immensely, I never tell their names to any one. It is like surrendering a part of them. I have grown to love secrecy. It seems to be the one thing that can make modern life mysterious or marvellous to us. The commonest thing is delightful if one only hides it. When I leave town now I never tell my people where I am going. If I did, I would lose all my pleasure. It is a silly habit, I dare say, but somehow it seems to bring a great deal of romance into one s life. I suppose you think me awfully foolish about it?",Lord Henry,Basil Hallward,NO MONOLOGUE,0,1,Implicit,,0.622503063743185,0.0768897693917457
26,26,26,27," answered Lord Henry, ","Not at all, /newquote not at all, my dear Basil. You seem to forget that I am married, and the one charm of marriage is that it makes a life of deception absolutely necessary for both parties. I never know where my wife is, and my wife never knows what I am doing. When we meet we do meet occasionally, when we dine out together, or go down to the Duke s we tell each other the most absurd stories with the most serious faces. My wife is very good at it much better, in fact, than I am. She never gets confused over her dates, and I always do. But when she does find me out, she makes no row at all. I sometimes wish she would; but she merely laughs at me.",Lord Henry,Basil Hallward,NO MONOLOGUE,0,1,Explicit,answered Lord Henry,0.994555864052412,0.2008273740449863
27,27,27,28," said Basil Hallward, strolling towards the door that led into the garden. ","I hate the way you talk about your married life, Harry, /newquote I believe that you are really a very good husband, but that you are thoroughly ashamed of your own virtues. You are an extraordinary fellow. You never say a moral thing, and you never do a wrong thing. Your cynicism is simply a pose.",Basil Hallward,Lord Henry,NO MONOLOGUE,0,1,Explicit,said Basil Hallward,0.9946780918839976,0.7162391714543255
28,28,28,29," cried Lord Henry, laughing; and the two young men went out into the garden together and ensconced themselves on a long bamboo seat that stood in the shade of a tall laurel bush. The sunlight slipped over the polished leaves. In the grass, white daisies were tremulous.","Being natural is simply a pose, and the most irritating pose I know,",Lord Henry,Basil Hallward,NO MONOLOGUE,0,1,Explicit,cried Lord Henry,0.9841831319978468,0.1787495039538179
29,29,29,30,"After a pause, Lord Henry pulled out his watch.  /newquote  he murmured, ","I am afraid I must be going, Basil, /newquote and before I go, I insist on your answering a question I put to you some time ago.",Lord Henry,Basil Hallward,NO MONOLOGUE,0,1,Anaphoric,he murmured,0.1484402746461082,0.6422352572471746
30,30,30,31," said the painter, keeping his eyes fixed on the ground.",What is that?,Basil Hallward,Lord Henry,NO MONOLOGUE,0,1,Anaphoric,said the painter,0.3238839460346738,0.3333078407481653
31,31,31,32,NO APPEND,You know quite well.,Lord Henry,Basil Hallward,NO MONOLOGUE,0,1,Implicit,,0.5096096377896238,0.3708376558028333
32,32,32,33,NO APPEND,"I do not, Harry.",Basil Hallward,Lord Henry,NO MONOLOGUE,0,1,Implicit,,0.2705146721256402,0.7043457671345875
33,33,33,34,NO APPEND,"Well, I will tell you what it is. I want you to explain to me why you won t exhibit Dorian Gray s picture. I want the real reason.",Lord Henry,Basil Hallward,NO MONOLOGUE,0,1,Implicit,,0.5058736258790781,0.143796754374223
34,34,34,35,NO APPEND,I told you the real reason.,Lord Henry,Basil Hallward,NO MONOLOGUE,0,1,Implicit,,0.4836970701001936,0.0724135971203889
35,35,35,36,NO APPEND,"No, you did not. You said it was because there was too much of yourself in it. Now, that is childish.",Lord Henry,Basil Hallward,NO MONOLOGUE,0,1,Implicit,,0.5270290208082836,0.1840481410172062
36,36,36,37," said Basil Hallward, looking him straight in the face, ","Harry, /newquote every portrait that is painted with feeling is a portrait of the artist, not of the sitter. The sitter is merely the accident, the occasion. It is not he who is revealed by the painter; it is rather the painter who, on the coloured canvas, reveals himself. The reason I will not exhibit this picture is that I am afraid that I have shown in it the secret of my own soul.",Basil Hallward,Lord Henry,NO MONOLOGUE,0,1,Explicit,said Basil Hallward,0.9951561304893954,0.4276158387056197
37,37,37,38,Lord Henry laughed.  /newquote  he asked.,And what is that?,Basil Hallward,Duchess Of Monmouth,NO MONOLOGUE,0,1,Anaphoric,he asked,0.3560651485153717,0.0175423620426879
38,38,38,39, said Hallward; but an expression of perplexity came over his face.,"I will tell you,",Basil Hallward,Lord Henry,NO MONOLOGUE,0,1,Explicit,said Hallward,0.9930990117996992,0.1495292542976274
39,39,39,40," continued his companion, glancing at him.","I am all expectation, Basil,",Lord Henry,Basil Hallward,NO MONOLOGUE,0,1,Anaphoric,continued his companion,0.4257821507702773,0.7685117234696855
40,40,40,41, answered the painter; ,"Oh, there is really very little to tell, Harry, /newquote and I am afraid you will hardly understand it. Perhaps you will hardly believe it.",Basil Hallward,Lord Henry,NO MONOLOGUE,0,1,Anaphoric,answered the painter,0.3919645957435426,0.4357190809522991
41,41,41,42,"Lord Henry smiled, and leaning down, plucked a pink-petalled daisy from the grass and examined it.  /newquote  he replied, gazing intently at the little golden, white-feathered disk, ","I am quite sure I shall understand it, /newquote and as for believing things, I can believe anything, provided that it is quite incredible.",Basil Hallward,Duchess Of Monmouth,NO MONOLOGUE,0,1,Anaphoric,he replied,0.3918037369590367,0.0175423620426879
43,43,43,44, said the painter after some time. ,"The story is simply this, /newquote Two months ago I went to a crush at Lady Brandon s. You know we poor artists have to show ourselves in society from time to time, just to remind the public that we are not savages. With an evening coat and a white tie, as you told me once, anybody, even a stock-broker, can gain a reputation for being civilized. Well, after I had been in the room about ten minutes, talking to huge overdressed dowagers and tedious academicians, I suddenly became conscious that some one was looking at me. I turned half-way round and saw Dorian Gray for the first time. When our eyes met, I felt that I was growing pale. A curious sensation of terror came over me. I knew that I had come face to face with some one whose mere personality was so fascinating that, if I allowed it to do so, it would absorb my whole nature, my whole soul, my very art itself. I did not want any external influence in my life. You know yourself, Harry, how independent I am by nature. I have always been my own master; had at least always been so, till I met Dorian Gray. Then but I don t know how to explain it to you. Something seemed to tell me that I was on the verge of a terrible crisis in my life. I had a strange feeling that fate had in store for me exquisite joys and exquisite sorrows. I grew afraid and turned to quit the room. It was not conscience that made me do so: it was a sort of cowardice. I take no credit to myself for trying to escape.",Basil Hallward,Lord Henry,NO MONOLOGUE,0,1,Anaphoric,said the painter,0.6275346925097405,0.4476950600345845
44,44,44,45,NO APPEND,"Conscience and cowardice are really the same things, Basil. Conscience is the trade-name of the firm. That is all.",Lord Henry,Basil Hallward,NO MONOLOGUE,0,1,Implicit,,0.4859754809956598,0.5773088170903795
45,45,45,46,NO APPEND,"I don t believe that, Harry, and I don t believe you do either. However, whatever was my motive and it may have been pride, for I used to be very proud I certainly struggled to the door. There, of course, I stumbled against Lady Brandon.  You are not going to run away so soon, Mr. Hallward?  she screamed out. You know her curiously shrill voice?",Duchess Of Monmouth,Lord Henry,NO MONOLOGUE,0,1,Implicit,,0.0134582583733854,0.7043457671345875
46,46,46,47," said Lord Henry, pulling the daisy to bits with his long nervous fingers.","Yes; she is a peacock in everything but beauty,",Lord Henry,Basil Hallward,NO MONOLOGUE,0,1,Explicit,said Lord Henry,0.9912247942470837,0.0955465714870174
47,47,47,48,NO APPEND,"I could not get rid of her. She brought me up to royalties, and people with stars and garters, and elderly ladies with gigantic tiaras and parrot noses. She spoke of me as her dearest friend. I had only met her once before, but she took it into her head to lionize me. I believe some picture of mine had made a great success at the time, at least had been chattered about in the penny newspapers, which is the nineteenth-century standard of immortality. Suddenly I found myself face to face with the young man whose personality had so strangely stirred me. We were quite close, almost touching. Our eyes met again. It was reckless of me, but I asked Lady Brandon to introduce me to him. Perhaps it was not so reckless, after all. It was simply inevitable. We would have spoken to each other without any introduction. I am sure of that. Dorian told me so afterwards. He, too, felt that we were destined to know each other.",Lord Henry,Basil Hallward,NO MONOLOGUE,0,1,Implicit,,0.6741141928579766,0.0955465714870174
48,48,48,49, asked his companion. ,"And how did Lady Brandon describe this wonderful young man? /newquote I know she goes in for giving a rapid _pr cis_ of all her guests. I remember her bringing me up to a truculent and red-faced old gentleman covered all over with orders and ribbons, and hissing into my ear, in a tragic whisper which must have been perfectly audible to everybody in the room, the most astounding details. I simply fled. I like to find out people for myself. But Lady Brandon treats her guests exactly as an auctioneer treats his goods. She either explains them entirely away, or tells one everything about them except what one wants to know.",Lord Henry,Basil Hallward,NO MONOLOGUE,0,1,Anaphoric,asked his companion,0.537491330669586,0.2078522262277251
49,49,49,50, said Hallward listlessly.,"Poor Lady Brandon! You are hard on her, Harry!",Basil Hallward,Lord Henry,NO MONOLOGUE,0,1,Explicit,said Hallward,0.9910563206644916,0.7145578852687274
50,50,50,51,NO APPEND,"My dear fellow, she tried to found a _salon_, and only succeeded in opening a restaurant. How could I admire her? But tell me, what did she say about Mr. Dorian Gray?",Lord Henry,Basil Hallward,NO MONOLOGUE,0,1,Implicit,,0.5191031546927709,0.1576152150986183
51,51,51,52,NO APPEND,"Oh, something like,  Charming boy poor dear mother and I absolutely inseparable. Quite forget what he does afraid he doesn t do anything oh, yes, plays the piano or is it the violin, dear Mr. Gray?  Neither of us could help laughing, and we became friends at once.",Lord Henry,Basil Hallward,NO MONOLOGUE,0,1,Explicit,said Dorian Gray,0.0211794280179732,0.2114319954530003
52,52,52,53," said the young lord, plucking another daisy.","Laughter is not at all a bad beginning for a friendship, and it is far the best ending for one,",Basil Hallward,Lord Henry,NO MONOLOGUE,0,1,Anaphoric,said the young lord,0.2980450811021442,0.1336064010591568
53,53,53,54,Hallward shook his head.  /newquote  he murmured ,"You don t understand what friendship is, Harry, /newquote or what enmity is, for that matter. You like every one; that is to say, you are indifferent to every one.",Basil Hallward,Lord Henry,NO MONOLOGUE,0,1,Anaphoric,he murmured,0.4471127682796521,0.4517821489634051
54,54,54,55," cried Lord Henry, tilting his hat back and looking up at the little clouds that, like ravelled skeins of glossy white silk, were drifting across the hollowed turquoise of the summer sky. ","How horribly unjust of you! /newquote Yes; horribly unjust of you. I make a great difference between people. I choose my friends for their good looks, my acquaintances for their good characters, and my enemies for their good intellects. A man cannot be too careful in the choice of his enemies. I have not got one who is a fool. They are all men of some intellectual power, and consequently they all appreciate me. Is that very vain of me? I think it is rather vain.",Lord Henry,Basil Hallward,NO MONOLOGUE,0,1,Explicit,cried Lord Henry,0.9930103669243744,0.3708376558028333
55,55,55,56,NO APPEND,"I should think it was, Harry. But according to your category I must be merely an acquaintance.",Basil Hallward,Lord Henry,NO MONOLOGUE,0,1,Implicit,,0.2739720942371186,0.7145578852687274
56,56,56,57,NO APPEND,"My dear old Basil, you are much more than an acquaintance.",Lord Henry,Basil Hallward,NO MONOLOGUE,0,1,Implicit,,0.4466876885659764,0.5239022758525252
57,57,57,58,NO APPEND,"And much less than a friend. A sort of brother, I suppose?",Lord Henry,Basil Hallward,NO MONOLOGUE,0,1,Implicit,,0.501338439662478,0.0309400992376146
58,58,58,59,NO APPEND,"Oh, brothers! I don t care for brothers. My elder brother won t die, and my younger brothers seem never to do anything else.",Lord Henry,Basil Hallward,NO MONOLOGUE,0,1,Implicit,,0.5374240888916139,0.2150566798997855
59,59,59,60," exclaimed Hallward, frowning.",Harry!,Basil Hallward,Lord Henry,NO MONOLOGUE,0,1,Explicit,said Hallward,0.990813802013176,0.3116634615910968
60,60,60,61,NO APPEND,"My dear fellow, I am not quite serious. But I can t help detesting my relations. I suppose it comes from the fact that none of us can stand other people having the same faults as ourselves. I quite sympathize with the rage of the English democracy against what they call the vices of the upper orders. The masses feel that drunkenness, stupidity, and immorality should be their own special property, and that if any one of us makes an ass of himself, he is poaching on their preserves. When poor Southwark got into the divorce court, their indignation was quite magnificent. And yet I don t suppose that ten per cent of the proletariat live correctly.",Lord Henry,Basil Hallward,NO MONOLOGUE,0,1,Implicit,,0.5843524065371215,0.3267166361532064
61,61,61,62,NO APPEND,"I don t agree with a single word that you have said, and, what is more, Harry, I feel sure you don t either.",Basil Hallward,Lord Henry,NO MONOLOGUE,0,1,Implicit,,0.3757735770538587,0.7060624605772845
62,62,62,63,Lord Henry stroked his pointed brown beard and tapped the toe of his patent-leather boot with a tasselled ebony cane. ,"How English you are Basil! That is the second time you have made that observation. If one puts forward an idea to a true Englishman always a rash thing to do he never dreams of considering whether the idea is right or wrong. The only thing he considers of any importance is whether one believes it oneself. Now, the value of an idea has nothing whatsoever to do with the sincerity of the man who expresses it. Indeed, the probabilities are that the more insincere the man is, the more purely intellectual will the idea be, as in that case it will not be coloured by either his wants, his desires, or his prejudices. However, I don t propose to discuss politics, sociology, or metaphysics with you. I like persons better than principles, and I like persons with no principles better than anything else in the world. Tell me more about Mr. Dorian Gray. How often do you see him?",Lord Henry,Basil Hallward,NO MONOLOGUE,0,1,Implicit,,0.6752374499855485,0.1851810302714014
63,63,63,64,NO APPEND,Every day. I couldn t be happy if I didn t see him every day. He is absolutely necessary to me.,Lord Henry,Basil Hallward,NO MONOLOGUE,0,1,Implicit,,0.514788055636868,0.0816182857226878
64,64,64,65,NO APPEND,How extraordinary! I thought you would never care for anything but your art.,Lord Henry,Basil Hallward,NO MONOLOGUE,0,1,Implicit,,0.5271300133864921,0.2078522262277251
65,65,65,66, said the painter gravely. ,"He is all my art to me now, /newquote I sometimes think, Harry, that there are only two eras of any importance in the world s history. The first is the appearance of a new medium for art, and the second is the appearance of a new personality for art also. What the invention of oil-painting was to the Venetians, the face of Antinous was to late Greek sculpture, and the face of Dorian Gray will some day be to me. It is not merely that I paint from him, draw from him, sketch from him. Of course, I have done all that. But he is much more to me than a model or a sitter. I won t tell you that I am dissatisfied with what I have done of him, or that his beauty is such that art cannot express it. There is nothing that art cannot express, and I know that the work I have done, since I met Dorian Gray, is good work, is the best work of my life. But in some curious way I wonder will you understand me? his personality has suggested to me an entirely new manner in art, an entirely new mode of style. I see things differently, I think of them differently. I can now recreate life in a way that was hidden from me before.  A dream of form in days of thought  who is it who says that? I forget; but it is what Dorian Gray has been to me. The merely visible presence of this lad for he seems to me little more than a lad, though he is really over twenty his merely visible presence ah! I wonder can you realize all that that means? Unconsciously he defines for me the lines of a fresh school, a school that is to have in it all the passion of the romantic spirit, all the perfection of the spirit that is Greek. The harmony of soul and body how much that is! We in our madness have separated the two, and have invented a realism that is vulgar, an ideality that is void. Harry! if you only knew what Dorian Gray is to me! You remember that landscape of mine, for which Agnew offered me such a huge price but which I would not part with? It is one of the best things I have ever done. And why is it so? Because, while I was painting it, Dorian Gray sat beside me. Some subtle influence passed from him to me, and for the first time in my life I saw in the plain woodland the wonder I had always looked for and always missed.",Basil Hallward,Lord Henry,NO MONOLOGUE,0,1,Anaphoric,said the painter,0.7577252128993297,0.7077733217419733
66,66,66,67,NO APPEND,"Basil, this is extraordinary! I must see Dorian Gray.",Lord Henry,Basil Hallward,NO MONOLOGUE,0,1,Implicit,,0.500261617247416,0.7798414433720976
67,67,67,68,"Hallward got up from the seat and walked up and down the garden. After some time he came back.  /newquote  he said, ","Harry, /newquote Dorian Gray is to me simply a motive in art. You might see nothing in him. I see everything in him. He is never more present in my work than when no image of him is there. He is a suggestion, as I have said, of a new manner. I find him in the curves of certain lines, in the loveliness and subtleties of certain colours. That is all.",Basil Hallward,Lord Henry,NO MONOLOGUE,0,1,Anaphoric,he said,0.4522173058600001,0.7111774343832578
68,68,68,69, asked Lord Henry.,Then why won t you exhibit his portrait?,Lord Henry,Basil Hallward,NO MONOLOGUE,0,1,Explicit,asked Lord Henry,0.9909781156780764,0.3658109825073762
69,69,69,70,NO APPEND,"Because, without intending it, I have put into it some expression of all this curious artistic idolatry, of which, of course, I have never cared to speak to him. He knows nothing about it. He shall never know anything about it. But the world might guess it, and I will not bare my soul to their shallow prying eyes. My heart shall never be put under their microscope. There is too much of myself in the thing, Harry too much of myself!",Basil Hallward,Lord Henry,NO MONOLOGUE,0,1,Implicit,,0.2921045871477308,0.7043457671345875
70,70,70,71,NO APPEND,Poets are not so scrupulous as you are. They know how useful passion is for publication. Nowadays a broken heart will run to many editions.,Lord Henry,Basil Hallward,NO MONOLOGUE,0,1,Implicit,,0.5351810388267224,0.3034125790203615
71,71,71,72, cried Hallward. ,"I hate them for it, /newquote An artist should create beautiful things, but should put nothing of his own life into them. We live in an age when men treat art as if it were meant to be a form of autobiography. We have lost the abstract sense of beauty. Some day I will show the world what it is; and for that reason the world shall never see my portrait of Dorian Gray.",Basil Hallward,Lord Henry,NO MONOLOGUE,0,1,Explicit,cried Hallward,0.9932821434338688,0.3388352849721773
72,72,72,73,NO APPEND,"I think you are wrong, Basil, but I won t argue with you. It is only the intellectually lost who ever argue. Tell me, is Dorian Gray very fond of you?",Lord Henry,Basil Hallward,NO MONOLOGUE,0,1,Implicit,,0.5211394245738225,0.6877078596157123
