,Unnamed: 0.1,Unnamed: 0,paragraph,append,dialogue,speaker,addressee,subject,sentiment,chapter,syntactic,referringExpression,probability_sp,probability_ad
911,911,911,912,He turned round.  /newquote  he cried. ,"What I have to say is this, /newquote You must give me some answer to these horrible charges that are made against you. If you tell me that they are absolutely untrue from beginning to end, I shall believe you. Deny them, Dorian, deny them! Can t you see what I am going through? My God! don t tell me that you are bad, and corrupt, and shameful.",Basil Hallward,Lord Henry,NO MONOLOGUE,0,12,Anaphoric,he cried,0.4566097744434464,0.2859458055839667
912,912,912,913,Dorian Gray smiled. There was a curl of contempt in his lips.  /newquote  he said quietly. ,"Come upstairs, Basil, /newquote I keep a diary of my life from day to day, and it never leaves the room in which it is written. I shall show it to you if you come with me.",Lord Henry,Basil Hallward,NO MONOLOGUE,0,12,Anaphoric,he said,0.0465828314652734,0.8333285819693981
913,913,913,914,NO APPEND,"I shall come with you, Dorian, if you wish it. I see I have missed my train. That makes no matter. I can go to-morrow. But don t ask me to read anything to-night. All I want is a plain answer to my question.",Basil Hallward,Lord Henry,NO MONOLOGUE,0,12,Implicit,,0.4314566482103353,0.0912988912910797
914,914,914,915,NO APPEND,That shall be given to you upstairs. I could not give it here. You will not have to read long.,Basil Hallward,Lord Henry,NO MONOLOGUE,0,12,Implicit,,0.4435680764071016,0.0304478551784152
916,916,916,917,"When they reached the top landing, Dorian set the lamp down on the floor, and taking out the key, turned it in the lock.  /newquote  he asked in a low voice.","You insist on knowing, Basil?",Lord Henry,Basil Hallward,NO MONOLOGUE,0,13,Anaphoric,he asked,0.0406244797185864,0.6458723651564032
917,917,917,918,NO APPEND,Yes.,Basil Hallward,Lord Henry,NO MONOLOGUE,0,13,Implicit,,0.3687438408310267,0.0912988912910797
918,918,918,919," he answered, smiling. Then he added, somewhat harshly,  /newquote ; and, taking up the lamp, he opened the door and went in. A cold current of air passed them, and the light shot up for a moment in a flame of murky orange. He shuddered.  /newquote  he whispered, as he placed the lamp on the table.","I am delighted, /newquote You are the one man in the world who is entitled to know everything about me. You have had more to do with my life than you think /newquote Shut the door behind you,",Basil Hallward,Lord Henry,NO MONOLOGUE,0,13,Anaphoric,he added,0.4630507789443897,0.0304478551784152
920,920,920,921,NO APPEND,"So you think that it is only God who sees the soul, Basil? Draw that curtain back, and you will see mine.",Lord Henry,Basil Hallward,NO MONOLOGUE,0,13,Implicit,,0.1519947862437561,0.6458723651564032
921,921,921,922,"The voice that spoke was cold and cruel.  /newquote  muttered Hallward, frowning.","You are mad, Dorian, or playing a part,",Basil Hallward,Lord Henry,NO MONOLOGUE,0,13,Explicit,muttered Hallward,0.9932031423466312,0.0912988912910797
922,922,922,923," said the young man, and he tore the curtain from its rod and flung it on the ground.","You won t? Then I must do it myself,",Basil Hallward,Lord Henry,NO MONOLOGUE,0,13,Anaphoric,said the young man,0.4788010642241912,0.0304478551784152
926,926,926,927," cried Hallward, at last. His own voice sounded shrill and curious in his ears.",What does this mean?,Basil Hallward,Lord Henry,NO MONOLOGUE,0,13,Explicit,cried Hallward,0.9892970977753582,0.0304478551784152
927,927,927,928," said Dorian Gray, crushing the flower in his hand, ","Years ago, when I was a boy, /newquote you met me, flattered me, and taught me to be vain of my good looks. One day you introduced me to a friend of yours, who explained to me the wonder of youth, and you finished a portrait of me that revealed to me the wonder of beauty. In a mad moment that, even now, I don t know whether I regret or not, I made a wish, perhaps you would call it a prayer....",Basil Hallward,Lord Henry,NO MONOLOGUE,0,13,Explicit,said Dorian Gray,0.0083632897287512,0.0304478551784152
928,928,928,929,NO APPEND,"I remember it! Oh, how well I remember it! No! the thing is impossible. The room is damp. Mildew has got into the canvas. The paints I used had some wretched mineral poison in them. I tell you the thing is impossible.",Basil Hallward,Lord Henry,NO MONOLOGUE,0,13,Implicit,,0.4146091902629347,0.0304478551784152
929,929,929,930," murmured the young man, going over to the window and leaning his forehead against the cold, mist-stained glass.","Ah, what is impossible?",Basil Hallward,Lord Henry,NO MONOLOGUE,0,13,Anaphoric,murmured the young man,0.4956308468581123,0.0304478551784152
930,930,930,931,NO APPEND,You told me you had destroyed it.,Basil Hallward,Lord Henry,NO MONOLOGUE,0,13,Implicit,,0.4260951348681293,0.0304478551784152
931,931,931,932,NO APPEND,I was wrong. It has destroyed me.,Basil Hallward,Lord Henry,NO MONOLOGUE,0,13,Implicit,,0.2750812793845526,0.0304478551784152
932,932,932,933,NO APPEND,I don t believe it is my picture.,Basil Hallward,Lord Henry,NO MONOLOGUE,0,13,Implicit,,0.2901993524935063,0.0304478551784152
933,933,933,934, said Dorian bitterly.,Can t you see your ideal in it?,Basil Hallward,Lord Henry,NO MONOLOGUE,0,13,Explicit,said Dorian,0.0082323084096306,0.0304478551784152
934,934,934,935,NO APPEND,"My ideal, as you call it...",Basil Hallward,Lord Henry,NO MONOLOGUE,0,13,Implicit,,0.389293905312081,0.0304478551784152
935,935,935,936,NO APPEND,As you called it.,Basil Hallward,Lord Henry,NO MONOLOGUE,0,13,Implicit,,0.423927380329445,0.1112439074166162
936,936,936,937,NO APPEND,"There was nothing evil in it, nothing shameful. You were to me such an ideal as I shall never meet again. This is the face of a satyr.",Lord Henry,Basil Hallward,NO MONOLOGUE,0,13,Implicit,,0.1557998150372111,0.0276677128323026
937,937,937,938,NO APPEND,It is the face of my soul.,Lord Henry,Duchess Of Monmouth,NO MONOLOGUE,0,13,Implicit,,0.1420157637923695,0.0175391046418528
938,938,938,939,NO APPEND,Christ! what a thing I must have worshipped! It has the eyes of a devil.,Lord Henry,Duchess Of Monmouth,NO MONOLOGUE,0,13,Implicit,,0.1477580706577866,0.0175391046418528
939,939,939,940, cried Dorian with a wild gesture of despair.,"Each of us has heaven and hell in him, Basil,",Lord Henry,Basil Hallward,NO MONOLOGUE,0,13,Explicit,cried Dorian,0.0024139115772495,0.6746358905266597
940,940,940,941,"Hallward turned again to the portrait and gazed at it.  /newquote  he exclaimed,  /newquote  He held the light up again to the canvas and examined it. The surface seemed to be quite undisturbed and as he had left it. It was from within, apparently, that the foulness and horror had come. Through some strange quickening of inner life the leprosies of sin were slowly eating the thing away. The rotting of a corpse in a watery grave was not so fearful.","My God! If it is true, /newquote and this is what you have done with your life, why, you must be worse even than those who talk against you fancy you to be!",Basil Hallward,Lord Henry,NO MONOLOGUE,0,13,Anaphoric,he exclaimed,0.4954207782352631,0.0912988912910797
942,942,942,943," There was no answer, but he could hear the young man sobbing at the window.  /newquote  he murmured. ","Good God, Dorian, what a lesson! What an awful lesson! /newquote Pray, Dorian, pray, /newquote What is it that one was taught to say in one s boyhood?  Lead us not into temptation. Forgive us our sins. Wash away our iniquities.  Let us say that together. The prayer of your pride has been answered. The prayer of your repentance will be answered also. I worshipped you too much. I am punished for it. You worshipped yourself too much. We are both punished.",Basil Hallward,Lord Henry,NO MONOLOGUE,0,13,Anaphoric,he murmured,0.5369340076779966,0.1112439074166162
943,943,943,944,Dorian Gray turned slowly around and looked at him with tear-dimmed eyes.  /newquote  he faltered.,"It is too late, Basil,",Lord Henry,Basil Hallward,NO MONOLOGUE,0,13,Anaphoric,he faltered,0.0403504533202915,0.8368616905959917
944,944,944,945,NO APPEND,"It is never too late, Dorian. Let us kneel down and try if we cannot remember a prayer. Isn t there a verse somewhere,  Though your sins be as scarlet, yet I will make them as white as snow ?",Basil Hallward,Lord Henry,NO MONOLOGUE,0,13,Implicit,,0.4384407393781498,0.0912988912910797
945,945,945,946,NO APPEND,Those words mean nothing to me now.,Basil Hallward,Lord Henry,NO MONOLOGUE,0,13,Implicit,,0.4172723934197407,0.0304478551784152
946,946,946,947,NO APPEND,Hush! Don t say that. You have done enough evil in your life. My God! Don t you see that accursed thing leering at us?,Basil Hallward,Lord Henry,NO MONOLOGUE,0,13,Implicit,,0.4376570839722762,0.0304478551784152
959,959,959,960," he said, stepping in; ","I am sorry to have had to wake you up, Francis, /newquote but I had forgotten my latch-key. What time is it?",Basil Hallward,Lord Henry,NO MONOLOGUE,0,13,Anaphoric,he said,0.2962384750069426,0.0304478551784152
960,960,960,961," answered the man, looking at the clock and blinking.","Ten minutes past two, sir,",Basil Hallward,Lord Henry,NO MONOLOGUE,0,13,Anaphoric,answered the man,0.3183027584338364,0.0304478551784152
961,961,961,962,NO APPEND,Ten minutes past two? How horribly late! You must wake me at nine to-morrow. I have some work to do.,Basil Hallward,Lord Henry,NO MONOLOGUE,0,13,Implicit,,0.338311380209327,0.0304478551784152
962,962,962,963,NO APPEND,"All right, sir.",Basil Hallward,Lord Henry,NO MONOLOGUE,0,13,Implicit,,0.3361129460471663,0.0304478551784152
963,963,963,964,NO APPEND,Did any one call this evening?,Basil Hallward,Lord Henry,NO MONOLOGUE,0,13,Implicit,,0.3721054699161979,0.1112439074166162
964,964,964,965,NO APPEND,"Mr. Hallward, sir. He stayed here till eleven, and then he went away to catch his train.",Lord Henry,Basil Hallward,NO MONOLOGUE,0,13,Implicit,,0.1497999157799767,0.8260791402564477
965,965,965,966,NO APPEND,Oh! I am sorry I didn t see him. Did he leave any message?,Basil Hallward,Lord Henry,NO MONOLOGUE,0,13,Implicit,,0.4113184535648398,0.0912988912910797
966,966,966,967,NO APPEND,"No, sir, except that he would write to you from Paris, if he did not find you at the club.",Basil Hallward,Lord Henry,NO MONOLOGUE,0,13,Implicit,,0.3370714103405368,0.0304478551784152
967,967,967,968,NO APPEND,"That will do, Francis. Don t forget to call me at nine to-morrow.",Basil Hallward,Lord Henry,NO MONOLOGUE,0,13,Implicit,,0.3423263576438212,0.0304478551784152
968,968,968,969,NO APPEND,"No, sir.",Basil Hallward,Lord Henry,NO MONOLOGUE,0,13,Implicit,,0.3520663212229629,0.0304478551784152
970,970,970,971,"Dorian Gray threw his hat and coat upon the table and passed into the library. For a quarter of an hour he walked up and down the room, biting his lip and thinking. Then he took down the Blue Book from one of the shelves and began to turn over the leaves.  /newquote  Yes; that was the man he wanted.","Alan Campbell, 152, Hertford Street, Mayfair.",Basil Hallward,Lord Henry,NO MONOLOGUE,0,13,Implicit,,0.4095744245648974,0.0304478551784152
976,976,976,977,"When the half-hour struck, he passed his hand across his forehead, and then got up hastily and dressed himself with even more than his usual care, giving a good deal of attention to the choice of his necktie and scarf-pin and changing his rings more than once. He spent a long time also over breakfast, tasting the various dishes, talking to his valet about some new liveries that he was thinking of getting made for the servants at Selby, and going through his correspondence. At some of the letters, he smiled. Three of them bored him. One he read several times over and then tore up with a slight look of annoyance in his face.  /newquote  as Lord Henry had once said.","That awful thing, a woman s memory!",Lord Henry,Basil Hallward,NO MONOLOGUE,0,14,Anaphoric,rejoined his companion,0.3409175104167549,0.0861630582453213
978,978,978,979,NO APPEND,"Take this round to 152, Hertford Street, Francis, and if Mr. Campbell is out of town, get his address.",Lord Henry,Basil Hallward,NO MONOLOGUE,0,14,Implicit,,0.4482204133170643,0.0902901656502188
987,987,987,988,"He sighed, and took up the volume again, and tried to forget. He read of the swallows that fly in and out of the little _caf _ at Smyrna where the Hadjis sit counting their amber beads and the turbaned merchants smoke their long tasselled pipes and talk gravely to each other; he read of the Obelisk in the Place de la Concorde that weeps tears of granite in its lonely sunless exile and longs to be back by the hot, lotus-covered Nile, where there are Sphinxes, and rose-red ibises, and white vultures with gilded claws, and crocodiles with small beryl eyes that crawl over the green steaming mud; he began to brood over those verses which, drawing music from kiss-stained marble, tell of that curious statue that Gautier compares to a contralto voice, the  /newquote  that couches in the porphyry-room of the Louvre. But after a time the book fell from his hand. He grew nervous, and a horrible fit of terror came over him. What if Alan Campbell should be out of England? Days would elapse before he could come back. Perhaps he might refuse to come. What could he do then? Every moment was of vital importance.",_monstre charmant_,Lord Henry,Basil Hallward,NO MONOLOGUE,0,14,Explicit,said Lord Henry,0.9338932305816467,0.1136962111373673
993,993,993,994, said the man.,"Mr. Campbell, sir,",Basil Hallward,Lord Henry,NO MONOLOGUE,0,14,Anaphoric,said the man,0.4301428900293568,0.0304478551784152
995,995,995,996, He felt that he was himself again. His mood of cowardice had passed away.,"Ask him to come in at once, Francis.",Basil Hallward,Lord Henry,NO MONOLOGUE,0,14,Implicit,,0.4356465895356967,0.0304478551784152
997,997,997,998,NO APPEND,Alan! This is kind of you. I thank you for coming.,Lord Henry,Duchess Of Monmouth,NO MONOLOGUE,0,14,Implicit,,0.1449881606303714,0.0175391046418528
998,998,998,999," His voice was hard and cold. He spoke with slow deliberation. There was a look of contempt in the steady searching gaze that he turned on Dorian. He kept his hands in the pockets of his Astrakhan coat, and seemed not to have noticed the gesture with which he had been greeted.","I had intended never to enter your house again, Gray. But you said it was a matter of life and death.",Lord Henry,Duchess Of Monmouth,NO MONOLOGUE,0,14,Implicit,,0.1514759831573432,0.0175391046418528
999,999,999,1000,NO APPEND,"Yes: it is a matter of life and death, Alan, and to more than one person. Sit down.",Lord Henry,Duchess Of Monmouth,NO MONOLOGUE,0,14,Implicit,,0.1491593542082894,0.0175391046418528
1001,1001,1001,1002,"After a strained moment of silence, he leaned across and said, very quietly, but watching the effect of each word upon the face of him he had sent for, ","Alan, in a locked room at the top of this house, a room to which nobody but myself has access, a dead man is seated at a table. He has been dead ten hours now. Don t stir, and don t look at me like that. Who the man is, why he died, how he died, are matters that do not concern you. What you have to do is this ",Lord Henry,Duchess Of Monmouth,NO MONOLOGUE,0,14,Anaphoric,he leaned across and said,0.053264754755293,0.0175391046418528
1002,1002,1002,1003,NO APPEND,"Stop, Gray. I don t want to know anything further. Whether what you have told me is true or not true doesn t concern me. I entirely decline to be mixed up in your life. Keep your horrible secrets to yourself. They don t interest me any more.",Lord Henry,Duchess Of Monmouth,NO MONOLOGUE,0,14,Implicit,,0.1705130654349105,0.0175391046418528
1003,1003,1003,1004,NO APPEND,"Alan, they will have to interest you. This one will have to interest you. I am awfully sorry for you, Alan. But I can t help myself. You are the one man who is able to save me. I am forced to bring you into the matter. I have no option. Alan, you are scientific. You know about chemistry and things of that kind. You have made experiments. What you have got to do is to destroy the thing that is upstairs to destroy it so that not a vestige of it will be left. Nobody saw this person come into the house. Indeed, at the present moment he is supposed to be in Paris. He will not be missed for months. When he is missed, there must be no trace of him found here. You, Alan, you must change him, and everything that belongs to him, into a handful of ashes that I may scatter in the air.",Lord Henry,Duchess Of Monmouth,NO MONOLOGUE,0,14,Implicit,,0.2619553444717909,0.0175391046418528
1004,1004,1004,1005,NO APPEND,"You are mad, Dorian.",Lord Henry,Duchess Of Monmouth,NO MONOLOGUE,0,14,Implicit,,0.1412806551713125,0.0175391046418528
1005,1005,1005,1006,NO APPEND,Ah! I was waiting for you to call me Dorian.,Lord Henry,Duchess Of Monmouth,NO MONOLOGUE,0,14,Implicit,,0.1442402527480396,0.0175391046418528
1006,1006,1006,1007,NO APPEND,"You are mad, I tell you mad to imagine that I would raise a finger to help you, mad to make this monstrous confession. I will have nothing to do with this matter, whatever it is. Do you think I am going to peril my reputation for you? What is it to me what devil s work you are up to?",Lord Henry,Duchess Of Monmouth,NO MONOLOGUE,0,14,Implicit,,0.1767294298979025,0.0175391046418528
1007,1007,1007,1008,NO APPEND,"It was suicide, Alan.",Lord Henry,Duchess Of Monmouth,NO MONOLOGUE,0,14,Implicit,,0.1414029521209716,0.0175391046418528
1008,1008,1008,1009,NO APPEND,"I am glad of that. But who drove him to it? You, I should fancy.",Lord Henry,Duchess Of Monmouth,NO MONOLOGUE,0,14,Implicit,,0.1467458038906903,0.0175391046418528
1009,1009,1009,1010,NO APPEND,Do you still refuse to do this for me?,Lord Henry,Basil Hallward,NO MONOLOGUE,0,14,Implicit,,0.14349555539322,0.0342753205609377
1010,1010,1010,1011,NO APPEND,"Of course I refuse. I will have absolutely nothing to do with it. I don t care what shame comes on you. You deserve it all. I should not be sorry to see you disgraced, publicly disgraced. How dare you ask me, of all men in the world, to mix myself up in this horror? I should have thought you knew more about people s characters. Your friend Lord Henry Wotton can t have taught you much about psychology, whatever else he has taught you. Nothing will induce me to stir a step to help you. You have come to the wrong man. Go to some of your friends. Don t come to me.",Basil Hallward,Lord Henry,NO MONOLOGUE,0,14,Implicit,,0.0242721046739897,0.1177106658360562
1011,1011,1011,1012,NO APPEND,"Alan, it was murder. I killed him. You don t know what he had made me suffer. Whatever my life is, he had more to do with the making or the marring of it than poor Harry has had. He may not have intended it, the result was the same.",Duchess Of Monmouth,Lord Henry,NO MONOLOGUE,0,14,Implicit,,0.0228972524734937,0.1478978352710997
1012,1012,1012,1013,NO APPEND,"Murder! Good God, Dorian, is that what you have come to? I shall not inform upon you. It is not my business. Besides, without my stirring in the matter, you are certain to be arrested. Nobody ever commits a crime without doing something stupid. But I will have nothing to do with it.",Lord Henry,Duchess Of Monmouth,NO MONOLOGUE,0,14,Implicit,,0.5389785966289103,0.025820307197405
1013,1013,1013,1014,NO APPEND,"You must have something to do with it. Wait, wait a moment; listen to me. Only listen, Alan. All I ask of you is to perform a certain scientific experiment. You go to hospitals and dead-houses, and the horrors that you do there don t affect you. If in some hideous dissecting-room or fetid laboratory you found this man lying on a leaden table with red gutters scooped out in it for the blood to flow through, you would simply look upon him as an admirable subject. You would not turn a hair. You would not believe that you were doing anything wrong. On the contrary, you would probably feel that you were benefiting the human race, or increasing the sum of knowledge in the world, or gratifying intellectual curiosity, or something of that kind. What I want you to do is merely what you have often done before. Indeed, to destroy a body must be far less horrible than what you are accustomed to work at. And, remember, it is the only piece of evidence against me. If it is discovered, I am lost; and it is sure to be discovered unless you help me.",Lord Henry,Duchess Of Monmouth,NO MONOLOGUE,0,14,Implicit,,0.7519079858411202,0.0175391046418528
1014,1014,1014,1015,NO APPEND,I have no desire to help you. You forget that. I am simply indifferent to the whole thing. It has nothing to do with me.,Lord Henry,Duchess Of Monmouth,NO MONOLOGUE,0,14,Implicit,,0.5483167849927754,0.0175391046418528
1015,1015,1015,1016,NO APPEND,"Alan, I entreat you. Think of the position I am in. Just before you came I almost fainted with terror. You may know terror yourself some day. No! don t think of that. Look at the matter purely from the scientific point of view. You don t inquire where the dead things on which you experiment come from. Don t inquire now. I have told you too much as it is. But I beg of you to do this. We were friends once, Alan.",Lord Henry,Duchess Of Monmouth,NO MONOLOGUE,0,14,Implicit,,0.619899989274912,0.0175391046418528
1016,1016,1016,1017,NO APPEND,"Don t speak about those days, Dorian they are dead.",Lord Henry,Duchess Of Monmouth,NO MONOLOGUE,0,14,Implicit,,0.5460961988580809,0.0175391046418528
1017,1017,1017,1018,NO APPEND,"The dead linger sometimes. The man upstairs will not go away. He is sitting at the table with bowed head and outstretched arms. Alan! Alan! If you don t come to my assistance, I am ruined. Why, they will hang me, Alan! Don t you understand? They will hang me for what I have done.",Lord Henry,Duchess Of Monmouth,NO MONOLOGUE,0,14,Implicit,,0.6072718754805686,0.0175391046418528
1018,1018,1018,1019,NO APPEND,There is no good in prolonging this scene. I absolutely refuse to do anything in the matter. It is insane of you to ask me.,Lord Henry,Duchess Of Monmouth,NO MONOLOGUE,0,14,Implicit,,0.5739148514108086,0.0175391046418528
1019,1019,1019,1020,NO APPEND,You refuse?,Lord Henry,Duchess Of Monmouth,NO MONOLOGUE,0,14,Implicit,,0.5461138665870623,0.0175391046418528
1020,1020,1020,1021,NO APPEND,Yes.,Lord Henry,Duchess Of Monmouth,NO MONOLOGUE,0,14,Implicit,,0.544364856370338,0.0175391046418528
1021,1021,1021,1022,NO APPEND,"I entreat you, Alan.",Lord Henry,Duchess Of Monmouth,NO MONOLOGUE,0,14,Implicit,,0.1412806551713125,0.0175391046418528
1022,1022,1022,1023,NO APPEND,It is useless.,Lord Henry,Duchess Of Monmouth,NO MONOLOGUE,0,14,Implicit,,0.1405487283294439,0.0175391046418528
1026,1026,1026,1027," he murmured, ","I am so sorry for you, Alan, /newquote but you leave me no alternative. I have a letter written already. Here it is. You see the address. If you don t help me, I must send it. If you don t help me, I will send it. You know what the result will be. But you are going to help me. It is impossible for you to refuse now. I tried to spare you. You will do me the justice to admit that. You were stern, harsh, offensive. You treated me as no man has ever dared to treat me no living man, at any rate. I bore it all. Now it is for me to dictate terms.",Lord Henry,Duchess Of Monmouth,NO MONOLOGUE,0,14,Anaphoric,he murmured,0.0664871276512209,0.0175391046418528
1028,1028,1028,1029,NO APPEND,"Yes, it is my turn to dictate terms, Alan. You know what they are. The thing is quite simple. Come, don t work yourself into this fever. The thing has to be done. Face it, and do it.",Lord Henry,Duchess Of Monmouth,NO MONOLOGUE,0,14,Implicit,,0.162268015526812,0.0175391046418528
1030,1030,1030,1031,NO APPEND,"Come, Alan, you must decide at once.",Lord Henry,Duchess Of Monmouth,NO MONOLOGUE,0,14,Implicit,,0.1432480351658376,0.0175391046418528
1031,1031,1031,1032," he said, mechanically, as though words could alter things.","I cannot do it,",Lord Henry,Duchess Of Monmouth,NO MONOLOGUE,0,14,Implicit,,0.1406704954896075,0.0175391046418528
1032,1032,1032,1033,NO APPEND,You must. You have no choice. Don t delay.,Lord Henry,Duchess Of Monmouth,NO MONOLOGUE,0,14,Implicit,,0.1439916639208415,0.0175391046418528
1033,1033,1033,1034,He hesitated a moment. ,Is there a fire in the room upstairs?,Lord Henry,Duchess Of Monmouth,NO MONOLOGUE,0,14,Implicit,,0.1433717508040017,0.0175391046418528
1034,1034,1034,1035,NO APPEND,"Yes, there is a gas-fire with asbestos.",Lord Henry,Duchess Of Monmouth,NO MONOLOGUE,0,14,Implicit,,0.143619448966535,0.0175391046418528
1035,1035,1035,1036,NO APPEND,I shall have to go home and get some things from the laboratory.,Lord Henry,Duchess Of Monmouth,NO MONOLOGUE,0,14,Implicit,,0.1467458038906903,0.0175391046418528
1036,1036,1036,1037,NO APPEND,"No, Alan, you must not leave the house. Write out on a sheet of notepaper what you want and my servant will take a cab and bring the things back to you.",Lord Henry,Duchess Of Monmouth,NO MONOLOGUE,0,14,Implicit,,0.1582004022978889,0.0175391046418528
1039,1039,1039,1040,"As the chime struck one, Campbell turned round, and looking at Dorian Gray, saw that his eyes were filled with tears. There was something in the purity and refinement of that sad face that seemed to enrage him.  /newquote  he muttered.","You are infamous, absolutely infamous!",Lord Henry,Duchess Of Monmouth,NO MONOLOGUE,0,14,Anaphoric,he muttered,0.0409794187669002,0.0175391046418528
1040,1040,1040,1041, said Dorian.,"Hush, Alan. You have saved my life,",Lord Henry,Duchess Of Monmouth,NO MONOLOGUE,0,14,Explicit,said Dorian,0.0023897669430422,0.0175391046418528
