,Unnamed: 0.1,Unnamed: 0,paragraph,append,dialogue,speaker,addressee,subject,sentiment,chapter,syntactic,referringExpression,probability_sp,probability_ad
763,763,763,764,"Dorian Gray passed his hand over his forehead. There were beads of perspiration there. He felt that he was on the brink of a horrible danger.  /newquote  he cried.  /newquote  He stopped suddenly, and a gleam of light came into his eyes. He remembered that Lord Henry had said to him once, half seriously and half in jest,  /newquote  Yes, perhaps Basil, too, had his secret. He would ask him and try.","You told me a month ago that you would never exhibit it, /newquote Why have you changed your mind? You people who go in for being consistent have just as many moods as others have. The only difference is that your moods are rather meaningless. You can t have forgotten that you assured me most solemnly that nothing in the world would induce you to send it to any exhibition. You told Harry exactly the same thing. /newquote If you want to have a strange quarter of an hour, get Basil to tell you why he won t exhibit your picture. He told me why he wouldn t, and it was a revelation to me.",Basil Hallward,Lord Henry,NO MONOLOGUE,0,9,Anaphoric,he cried,0.0343570425830502,0.1593453671068922
764,764,764,765," he said, coming over quite close and looking him straight in the face, ","Basil, /newquote we have each of us a secret. Let me know yours, and I shall tell you mine. What was your reason for refusing to exhibit my picture?",Lord Henry,Basil Hallward,NO MONOLOGUE,0,9,Anaphoric,he said,0.1869251519277537,0.4833727073168495
765,765,765,766,The painter shuddered in spite of himself. ,"Dorian, if I told you, you might like me less than you do, and you would certainly laugh at me. I could not bear your doing either of those two things. If you wish me never to look at your picture again, I am content. I have always you to look at. If you wish the best work I have ever done to be hidden from the world, I am satisfied. Your friendship is dearer to me than any fame or reputation.",Lord Henry,Basil Hallward,NO MONOLOGUE,0,9,Implicit,,0.5326746810314,0.0260666071417626
766,766,766,767," insisted Dorian Gray.  /newquote  His feeling of terror had passed away, and curiosity had taken its place. He was determined to find out Basil Hallward s mystery.","No, Basil, you must tell me, /newquote I think I have a right to know.",Lord Henry,Basil Hallward,NO MONOLOGUE,0,9,Explicit,insisted Dorian Gray,0.0127838607740519,0.5340183464610413
767,767,767,768," said the painter, looking troubled. ","Let us sit down, Dorian, /newquote Let us sit down. And just answer me one question. Have you noticed in the picture something curious? something that probably at first did not strike you, but that revealed itself to you suddenly?",Basil Hallward,Lord Henry,NO MONOLOGUE,0,9,Anaphoric,said the painter,0.3492165838651386,0.3913228161016117
768,768,768,769," cried the lad, clutching the arms of his chair with trembling hands and gazing at him with wild startled eyes.",Basil!,Lord Henry,Basil Hallward,NO MONOLOGUE,0,9,Implicit,,0.4661945069913891,0.4746709782331507
769,769,769,770,NO APPEND,"I see you did. Don t speak. Wait till you hear what I have to say. Dorian, from the moment I met you, your personality had the most extraordinary influence over me. I was dominated, soul, brain, and power, by you. You became to me the visible incarnation of that unseen ideal whose memory haunts us artists like an exquisite dream. I worshipped you. I grew jealous of every one to whom you spoke. I wanted to have you all to myself. I was only happy when I was with you. When you were away from me, you were still present in my art.... Of course, I never let you know anything about this. It would have been impossible. You would not have understood it. I hardly understood it myself. I only knew that I had seen perfection face to face, and that the world had become wonderful to my eyes too wonderful, perhaps, for in such mad worships there is peril, the peril of losing them, no less than the peril of keeping them.... Weeks and weeks went on, and I grew more and more absorbed in you. Then came a new development. I had drawn you as Paris in dainty armour, and as Adonis with huntsman s cloak and polished boar-spear. Crowned with heavy lotus-blossoms you had sat on the prow of Adrian s barge, gazing across the green turbid Nile. You had leaned over the still pool of some Greek woodland and seen in the water s silent silver the marvel of your own face. And it had all been what art should be unconscious, ideal, and remote. One day, a fatal day I sometimes think, I determined to paint a wonderful portrait of you as you actually are, not in the costume of dead ages, but in your own dress and in your own time. Whether it was the realism of the method, or the mere wonder of your own personality, thus directly presented to me without mist or veil, I cannot tell. But I know that as I worked at it, every flake and film of colour seemed to me to reveal my secret. I grew afraid that others would know of my idolatry. I felt, Dorian, that I had told too much, that I had put too much of myself into it. Then it was that I resolved never to allow the picture to be exhibited. You were a little annoyed; but then you did not realize all that it meant to me. Harry, to whom I talked about it, laughed at me. But I did not mind that. When the picture was finished, and I sat alone with it, I felt that I was right.... Well, after a few days the thing left my studio, and as soon as I had got rid of the intolerable fascination of its presence, it seemed to me that I had been foolish in imagining that I had seen anything in it, more than that you were extremely good-looking and that I could paint. Even now I cannot help feeling that it is a mistake to think that the passion one feels in creation is ever really shown in the work one creates. Art is always more abstract than we fancy. Form and colour tell us of form and colour that is all. It often seems to me that art conceals the artist far more completely than it ever reveals him. And so when I got this offer from Paris, I determined to make your portrait the principal thing in my exhibition. It never occurred to me that you would refuse. I see now that you were right. The picture cannot be shown. You must not be angry with me, Dorian, for what I have told you. As I said to Harry, once, you are made to be worshipped.",Basil Hallward,Lord Henry,NO MONOLOGUE,0,9,Implicit,,0.3667091298263654,0.4076002690215507
771,771,771,772," said Hallward, ","It is extraordinary to me, Dorian, /newquote that you should have seen this in the portrait. Did you really see it?",Basil Hallward,Lord Henry,NO MONOLOGUE,0,9,Explicit,said Hallward,0.9928871740541416,0.0582490405529945
772,772,772,773," he answered, ","I saw something in it, /newquote something that seemed to me very curious.",Basil Hallward,Lord Henry,NO MONOLOGUE,0,9,Anaphoric,he answered,0.457857577951571,0.194686519318149
773,773,773,774,NO APPEND,"Well, you don t mind my looking at the thing now?",Lord Henry,Basil Hallward,NO MONOLOGUE,0,9,Implicit,,0.4605237702614409,0.2654272096813022
774,774,774,775,Dorian shook his head. ,"You must not ask me that, Basil. I could not possibly let you stand in front of that picture.",Lord Henry,Basil Hallward,NO MONOLOGUE,0,9,Implicit,,0.4959882419563884,0.2387631893226319
775,775,775,776,NO APPEND,"You will some day, surely?",Lord Henry,Basil Hallward,NO MONOLOGUE,0,9,Implicit,,0.5067770353674022,0.0297346814047464
776,776,776,777,NO APPEND,Never.,Lord Henry,Basil Hallward,NO MONOLOGUE,0,9,Implicit,,0.5246547917960211,0.1161271405363253
777,777,777,778,NO APPEND,"Well, perhaps you are right. And now good-bye, Dorian. You have been the one person in my life who has really influenced my art. Whatever I have done that is good, I owe to you. Ah! you don t know what it cost me to tell you all that I have told you.",Lord Henry,Basil Hallward,NO MONOLOGUE,0,9,Implicit,,0.6133707071355091,0.1277187081342287
778,778,778,779," said Dorian, ","My dear Basil, /newquote what have you told me? Simply that you felt that you admired me too much. That is not even a compliment.",Lord Henry,Basil Hallward,NO MONOLOGUE,0,9,Explicit,said Dorian,0.0197042687466161,0.0959609481220092
779,779,779,780,NO APPEND,"It was not intended as a compliment. It was a confession. Now that I have made it, something seems to have gone out of me. Perhaps one should never put one s worship into words.",Lord Henry,Basil Hallward,NO MONOLOGUE,0,9,Implicit,,0.6109283736355308,0.0847800172309922
780,780,780,781,NO APPEND,It was a very disappointing confession.,Basil Hallward,Lord Henry,NO MONOLOGUE,0,9,Implicit,,0.3974303141788989,0.0681275555500845
781,781,781,782,NO APPEND,"Why, what did you expect, Dorian? You didn t see anything else in the picture, did you? There was nothing else to see?",Basil Hallward,Lord Henry,NO MONOLOGUE,0,9,Implicit,,0.3809412218393938,0.0844961296048075
782,782,782,783,NO APPEND,"No; there was nothing else to see. Why do you ask? But you mustn t talk about worship. It is foolish. You and I are friends, Basil, and we must always remain so.",Lord Henry,Basil Hallward,NO MONOLOGUE,0,9,Implicit,,0.1292382213564046,0.7541512811170373
783,783,783,784, said the painter sadly.,"You have got Harry,",Basil Hallward,Lord Henry,NO MONOLOGUE,0,9,Explicit,said Dorian Gray,0.0117644230713645,0.1487915119488193
784,784,784,785," cried the lad, with a ripple of laughter. ","Oh, Harry! /newquote Harry spends his days in saying what is incredible and his evenings in doing what is improbable. Just the sort of life I would like to lead. But still I don t think I would go to Harry if I were in trouble. I would sooner go to you, Basil.",Basil Hallward,Lord Henry,NO MONOLOGUE,0,9,Anaphoric,cried the lad,0.0306701892075873,0.4749447490797862
785,785,785,786,NO APPEND,You will sit to me again?,Lord Henry,Basil Hallward,NO MONOLOGUE,0,9,Implicit,,0.5006484838171464,0.1902040494549214
786,786,786,787,NO APPEND,Impossible!,Basil Hallward,Lord Henry,NO MONOLOGUE,0,9,Anaphoric,he cried,0.4269493888333817,0.4034585915444224
787,787,787,788,NO APPEND,"You spoil my life as an artist by refusing, Dorian. No man comes across two ideal things. Few come across one.",Lord Henry,Basil Hallward,NO MONOLOGUE,0,9,Implicit,,0.5415525741346607,0.2761229131743099
788,788,788,789,NO APPEND,"I can t explain it to you, Basil, but I must never sit to you again. There is something fatal about a portrait. It has a life of its own. I will come and have tea with you. That will be just as pleasant.",Lord Henry,Basil Hallward,NO MONOLOGUE,0,9,Implicit,,0.5783508278525191,0.5069840544706853
789,789,789,790, murmured Hallward regretfully. ,"Pleasanter for you, I am afraid, /newquote And now good-bye. I am sorry you won t let me look at the picture once again. But that can t be helped. I quite understand what you feel about it.",Basil Hallward,Lord Henry,NO MONOLOGUE,0,9,Explicit,murmured Hallward,0.9932182212980488,0.1593566999766816
795,795,795,796, she exclaimed. ,"The old schoolroom, Mr. Dorian? /newquote Why, it is full of dust. I must get it arranged and put straight before you go into it. It is not fit for you to see, sir. It is not, indeed.",Basil Hallward,Lord Henry,NO MONOLOGUE,0,10,Implicit,,0.3920706054640261,0.0237639911984148
796,796,796,797,NO APPEND,"I don t want it put straight, Leaf. I only want the key.",Basil Hallward,Lord Henry,NO MONOLOGUE,0,10,Implicit,,0.3885271399323847,0.0237639911984148
797,797,797,798,NO APPEND,"Well, sir, you ll be covered with cobwebs if you go into it. Why, it hasn t been opened for nearly five years not since his lordship died.",Basil Hallward,Lord Henry,NO MONOLOGUE,0,10,Explicit,said Dorian Gray,0.0114731592197867,0.0237639911984148
799,799,799,800," said the old lady, going over the contents of her bunch with tremulously uncertain hands. ","And here is the key, sir, /newquote Here is the key. I ll have it off the bunch in a moment. But you don t think of living up there, sir, and you so comfortable here?",Basil Hallward,Lord Henry,NO MONOLOGUE,0,10,Explicit,said Dorian Gray,0.008765374203131,0.0844961296048075
805,805,805,806,NO APPEND,"The persons are here, Monsieur.",Lord Henry,Basil Hallward,NO MONOLOGUE,0,10,Implicit,,0.4040050528336577,0.0728123351840654
809,809,809,810," he said, rubbing his fat freckled hands. ","What can I do for you, Mr. Gray? /newquote I thought I would do myself the honour of coming round in person. I have just got a beauty of a frame, sir. Picked it up at a sale. Old Florentine. Came from Fonthill, I believe. Admirably suited for a religious subject, Mr. Gray.",Basil Hallward,Lord Henry,NO MONOLOGUE,0,10,Anaphoric,he said,0.3503632623022131,0.1733962338933919
810,810,810,811,NO APPEND,"I am so sorry you have given yourself the trouble of coming round, Mr. Hubbard. I shall certainly drop in and look at the frame though I don t go in much at present for religious art but to-day I only want a picture carried to the top of the house for me. It is rather heavy, so I thought I would ask you to lend me a couple of your men.",Lord Henry,Basil Hallward,NO MONOLOGUE,0,10,Implicit,,0.562940710693181,0.2301341689679368
811,811,811,812,NO APPEND,"No trouble at all, Mr. Gray. I am delighted to be of any service to you. Which is the work of art, sir?",Lord Henry,Basil Hallward,NO MONOLOGUE,0,10,Implicit,,0.5104507368120338,0.1054604142008687
812,812,812,813," replied Dorian, moving the screen back. ","This, /newquote Can you move it, covering and all, just as it is? I don t want it to get scratched going upstairs.",Lord Henry,Basil Hallward,NO MONOLOGUE,0,10,Explicit,replied Dorian,0.016889291565004,0.3125887410994817
813,813,813,814," said the genial frame-maker, beginning, with the aid of his assistant, to unhook the picture from the long brass chains by which it was suspended. ","There will be no difficulty, sir, /newquote And, now, where shall we carry it to, Mr. Gray?",Basil Hallward,Lord Henry,NO MONOLOGUE,0,10,Anaphoric,said the genial framemaker,0.4486085274859407,0.4034585915444224
814,814,814,815,NO APPEND,"I will show you the way, Mr. Hubbard, if you will kindly follow me. Or perhaps you had better go in front. I am afraid it is right at the top of the house. We will go up by the front staircase, as it is wider.",Lord Henry,Basil Hallward,NO MONOLOGUE,0,10,Implicit,,0.6081850281937512,0.0261285691066615
816,816,816,817, gasped the little man when they reached the top landing. And he wiped his shiny forehead.,"Something of a load to carry, sir,",Lord Henry,Duchess Of Monmouth,NO MONOLOGUE,0,10,Anaphoric,gasped the little man,0.0338354500071821,0.0175242851556853
817,817,817,818, murmured Dorian as he unlocked the door that opened into the room that was to keep for him the curious secret of his life and hide his soul from the eyes of men.,"I am afraid it is rather heavy,",Lord Henry,Duchess Of Monmouth,NO MONOLOGUE,0,10,Explicit,murmured Dorian,0.00181550626566,0.0175242851556853
821,821,821,822," he said, wearily, turning round. ","Bring it in, Mr. Hubbard, please, /newquote I am sorry I kept you so long. I was thinking of something else.",Basil Hallward,Lord Henry,NO MONOLOGUE,0,10,Anaphoric,he said,0.1707389729147829,0.0237639911984148
822,822,822,823," answered the frame-maker, who was still gasping for breath. ","Always glad to have a rest, Mr. Gray, /newquote Where shall we put it, sir?",Basil Hallward,Lord Henry,NO MONOLOGUE,0,10,Anaphoric,answered the framemaker,0.1935665534394709,0.0237639911984148
823,823,823,824,NO APPEND,"Oh, anywhere. Here: this will do. I don t want to have it hung up. Just lean it against the wall. Thanks.",Basil Hallward,Lord Henry,NO MONOLOGUE,0,10,Implicit,,0.1991887684607668,0.0237639911984148
824,824,824,825,NO APPEND,"Might one look at the work of art, sir?",Basil Hallward,Lord Henry,NO MONOLOGUE,0,10,Implicit,,0.2173529092781142,0.0237639911984148
825,825,825,826,"Dorian started.  /newquote  he said, keeping his eye on the man. He felt ready to leap upon him and fling him to the ground if he dared to lift the gorgeous hanging that concealed the secret of his life. ","It would not interest you, Mr. Hubbard, /newquote I shan t trouble you any more now. I am much obliged for your kindness in coming round.",Basil Hallward,Lord Henry,NO MONOLOGUE,0,10,Anaphoric,he said,0.3120275835767481,0.0237639911984148
826,826,826,827," And Mr. Hubbard tramped downstairs, followed by the assistant, who glanced back at Dorian with a look of shy wonder in his rough uncomely face. He had never seen any one so marvellous.","Not at all, not at all, Mr. Gray. Ever ready to do anything for you, sir.",Basil Hallward,Lord Henry,NO MONOLOGUE,0,10,Implicit,,0.2685575212703227,0.0237639911984148
837,837,837,838," he cried, ","I am so sorry, Harry, /newquote but really it is entirely your fault. That book you sent me so fascinated me that I forgot how the time was going.",James Vane,Lord Henry,NO MONOLOGUE,0,10,Anaphoric,he cried,0.4702050947621857,0.4901291532710176
838,838,838,839," replied his host, rising from his chair.","Yes, I thought you would like it,",Lord Henry,James Vane,NO MONOLOGUE,0,10,Implicit,,0.5553061797940622,0.3661397588311972
839,839,839,840,NO APPEND,"I didn t say I liked it, Harry. I said it fascinated me. There is a great difference.",Sibyl Vane,Lord Henry,NO MONOLOGUE,0,10,Implicit,,0.0896674136826219,0.7388419111561859
840,840,840,841, murmured Lord Henry. And they passed into the dining-room.,"Ah, you have discovered that?",Lord Henry,Sibyl Vane,NO MONOLOGUE,0,10,Explicit,murmured Lord Henry,0.9914340592889838,0.1589911409051595
846,846,846,847,"Yet he was not really reckless, at any rate in his relations to society. Once or twice every month during the winter, and on each Wednesday evening while the season lasted, he would throw open to the world his beautiful house and have the most celebrated musicians of the day to charm his guests with the wonders of their art. His little dinners, in the settling of which Lord Henry always assisted him, were noted as much for the careful selection and placing of those invited, as for the exquisite taste shown in the decoration of the table, with its subtle symphonic arrangements of exotic flowers, and embroidered cloths, and antique plate of gold and silver. Indeed, there were many, especially among the very young men, who saw, or fancied that they saw, in Dorian Gray the true realization of a type of which they had often dreamed in Eton or Oxford days, a type that was to combine something of the real culture of the scholar with all the grace and distinction and perfect manner of a citizen of the world. To them he seemed to be of the company of those whom Dante describes as having sought to  /newquote  Like Gautier, he was one for whom ",make themselves perfect by the worship of beauty. /newquote the visible world existed.,Lord Henry,Basil Hallward,NO MONOLOGUE,0,11,Implicit,,0.5754224861897397,0.056511748926436
853,853,853,854,"It was rumoured of him once that he was about to join the Roman Catholic communion, and certainly the Roman ritual had always a great attraction for him. The daily sacrifice, more awful really than all the sacrifices of the antique world, stirred him as much by its superb rejection of the evidence of the senses as by the primitive simplicity of its elements and the eternal pathos of the human tragedy that it sought to symbolize. He loved to kneel down on the cold marble pavement and watch the priest, in his stiff flowered dalmatic, slowly and with white hands moving aside the veil of the tabernacle, or raising aloft the jewelled, lantern-shaped monstrance with that pallid wafer that at times, one would fain think, is indeed the  /newquote  the bread of angels, or, robed in the garments of the Passion of Christ, breaking the Host into the chalice and smiting his breast for his sins. The fuming censers that the grave boys, in their lace and scarlet, tossed into the air like great gilt flowers had their subtle fascination for him. As he passed out, he used to look with wonder at the black confessionals and long to sit in the dim shadow of one of them and listen to men and women whispering through the worn grating the true story of their lives.","_panis c lestis_,",Lord Henry,Basil Hallward,NO MONOLOGUE,0,11,Explicit,said Lord Henry,0.9868317564341672,0.1080431549948699
856,856,856,857,"At another time he devoted himself entirely to music, and in a long latticed room, with a vermilion-and-gold ceiling and walls of olive-green lacquer, he used to give curious concerts in which mad gipsies tore wild music from little zithers, or grave, yellow-shawled Tunisians plucked at the strained strings of monstrous lutes, while grinning Negroes beat monotonously upon copper drums and, crouching upon scarlet mats, slim turbaned Indians blew through long pipes of reed or brass and charmed or feigned to charm great hooded snakes and horrible horned adders. The harsh intervals and shrill discords of barbaric music stirred him at times when Schubert s grace, and Chopin s beautiful sorrows, and the mighty harmonies of Beethoven himself, fell unheeded on his ear. He collected together from all parts of the world the strangest instruments that could be found, either in the tombs of dead nations or among the few savage tribes that have survived contact with Western civilizations, and loved to touch and try them. He had the mysterious _juruparis_ of the Rio Negro Indians, that women are not allowed to look at and that even youths may not see till they have been subjected to fasting and scourging, and the earthen jars of the Peruvians that have the shrill cries of birds, and flutes of human bones such as Alfonso de Ovalle heard in Chile, and the sonorous green jaspers that are found near Cuzco and give forth a note of singular sweetness. He had painted gourds filled with pebbles that rattled when they were shaken; the long _clarin_ of the Mexicans, into which the performer does not blow, but through which he inhales the air; the harsh _ture_ of the Amazon tribes, that is sounded by the sentinels who sit all day long in high trees, and can be heard, it is said, at a distance of three leagues; the _teponaztli_, that has two vibrating tongues of wood and is beaten with sticks that are smeared with an elastic gum obtained from the milky juice of plants; the _yotl_-bells of the Aztecs, that are hung in clusters like grapes; and a huge cylindrical drum, covered with the skins of great serpents, like the one that Bernal Diaz saw when he went with Cortes into the Mexican temple, and of whose doleful sound he has left us so vivid a description. The fantastic character of these instruments fascinated him, and he felt a curious delight in the thought that art, like Nature, has her monsters, things of bestial shape and with hideous voices. Yet, after some time, he wearied of them, and would sit in his box at the opera, either alone or with Lord Henry, listening in rapt pleasure to  /newquote  and seeing in the prelude to that great work of art a presentation of the tragedy of his own soul.",Tannhauser,Lord Henry,Duchess Of Monmouth,NO MONOLOGUE,0,11,Explicit,said Lord Henry,0.970388179144387,0.0175242851556853
858,858,858,859,"He discovered wonderful stories, also, about jewels. In Alphonso s Clericalis Disciplina a serpent was mentioned with eyes of real jacinth, and in the romantic history of Alexander, the Conqueror of Emathia was said to have found in the vale of Jordan snakes  /newquote  There was a gem in the brain of the dragon, Philostratus told us, and  /newquote  the monster could be thrown into a magical sleep and slain. According to the great alchemist, Pierre de Boniface, the diamond rendered a man invisible, and the agate of India made him eloquent. The cornelian appeased anger, and the hyacinth provoked sleep, and the amethyst drove away the fumes of wine. The garnet cast out demons, and the hydropicus deprived the moon of her colour. The selenite waxed and waned with the moon, and the meloceus, that discovers thieves, could be affected only by the blood of kids. Leonardus Camillus had seen a white stone taken from the brain of a newly killed toad, that was a certain antidote against poison. The bezoar, that was found in the heart of the Arabian deer, was a charm that could cure the plague. In the nests of Arabian birds was the aspilates, that, according to Democritus, kept the wearer from any danger by fire.",with collars of real emeralds growing on their backs. /newquote by the exhibition of golden letters and a scarlet robe,Lord Henry,Duchess Of Monmouth,NO MONOLOGUE,0,11,Explicit,said Lord Henry,0.9861321011706864,0.0175242851556853
