,Unnamed: 0,paragraph,append,dialogue,speaker,addressee,subject,sentiment,chapter,syntactic,referringExpression
238,238,238," repeated Holmes, pensively. ","Yes, the ally! /newquote There are features of interest about this ally. He lifts the case from the regions of the commonplace. I fancy that this ally breaks fresh ground in the annals of crime in this country, though parallel cases suggest themselves from India, and, if my memory serves me, from Senegambia.",Mr. Sherlock Holmes,Dr. Watson,NO MONOLOGUE,0,6,Explicit,repeated Holmes
239,239,239, I reiterated. ,"How came he, then? /newquote The door is locked, the window is inaccessible. Was it through the chimney?",Dr. Watson,Mr. Sherlock Holmes,NO MONOLOGUE,0,6,Anaphoric,I reiterated
240,240,240, he answered. ,"The grate is much too small, /newquote I had already considered that possibility.",Mr. Sherlock Holmes,Dr. Watson,NO MONOLOGUE,0,6,Anaphoric,he answered
241,241,241, I persisted.,How then?,Dr. Watson,Mr. Sherlock Holmes,NO MONOLOGUE,0,6,Anaphoric,I reiterated
242,242,242," he said, shaking his head. ","You will not apply my precept, /newquote How often have I said to you that when you have eliminated the impossible whatever remains, _however improbable_, must be the truth? We know that he did not come through the door, the window, or the chimney. We also know that he could not have been concealed in the room, as there is no concealment possible. Whence, then, did he come?",Mr. Sherlock Holmes,Dr. Watson,NO MONOLOGUE,0,6,Anaphoric,he said
243,243,243, I cried.,"He came through the hole in the roof,",Dr. Watson,Mr. Sherlock Holmes,NO MONOLOGUE,0,6,Anaphoric,I cried
244,244,244,NO APPEND,"Of course he did. He must have done so. If you will have the kindness to hold the lamp for me, we shall now extend our researches to the room above, the secret room in which the treasure was found.",Mr. Sherlock Holmes,Dr. Watson,NO MONOLOGUE,0,6,Implicit,
247,247,247," said Sherlock Holmes, putting his hand against the sloping wall. ","Here you are, you see, /newquote This is a trap-door which leads out on to the roof. I can press it back, and here is the roof itself, sloping at a gentle angle. This, then, is the way by which Number One entered. Let us see if we can find any other traces of his individuality.",Mr. Sherlock Holmes,Dr. Watson,NO MONOLOGUE,0,6,Explicit,said Sherlock Holmes
249,249,249," I said, in a whisper, ","Holmes, /newquote a child has done the horrid thing.",Dr. Watson,Mr. Sherlock Holmes,NO MONOLOGUE,0,6,Anaphoric,I said
250,250,250,"He had recovered his self-possession in an instant.  /newquote  he said, ","I was staggered for the moment, /newquote but the thing is quite natural. My memory failed me, or I should have been able to foretell it. There is nothing more to be learned here. Let us go down.",Mr. Sherlock Holmes,Dr. Watson,NO MONOLOGUE,0,6,Anaphoric,he said
251,251,251," I asked, eagerly, when we had regained the lower room once more.","What is your theory, then, as to those footmarks?",Dr. Watson,Mr. Sherlock Holmes,NO MONOLOGUE,0,6,Anaphoric,I asked
252,252,252," said he, with a touch of impatience. ","My dear Watson, try a little analysis yourself, /newquote You know my methods. Apply them, and it will be instructive to compare results.",Mr. Sherlock Holmes,Dr. Watson,NO MONOLOGUE,0,6,Anaphoric,said he
253,253,253, I answered.,"I cannot conceive anything which will cover the facts,",Dr. Watson,Mr. Sherlock Holmes,NO MONOLOGUE,0,6,Anaphoric,I answered
254,254,254," he said, in an off-hand way.  /newquote  He whipped out his lens and a tape measure, and hurried about the room on his knees, measuring, comparing, examining, with his long thin nose only a few inches from the planks, and his beady eyes gleaming and deep-set like those of a bird. So swift, silent, and furtive were his movements, like those of a trained blood-hound picking out a scent, that I could not but think what a terrible criminal he would have made had he turned his energy and sagacity against the law, instead of exerting them in its defence. As he hunted about, he kept muttering to himself, and finally he broke out into a loud crow of delight.","It will be clear enough to you soon, /newquote I think that there is nothing else of importance here, but I will look.",Mr. Sherlock Holmes,Dr. Watson,NO MONOLOGUE,0,6,Anaphoric,he said
255,255,255, said he. ,"We are certainly in luck, /newquote We ought to have very little trouble now. Number One has had the misfortune to tread in the creosote. You can see the outline of the edge of his small foot here at the side of this evil-smelling mess. The carboy has been cracked, You see, and the stuff has leaked out.",Mr. Sherlock Holmes,Dr. Watson,NO MONOLOGUE,0,6,Anaphoric,said he
256,256,256, I asked.,What then?,Dr. Watson,Mr. Sherlock Holmes,NO MONOLOGUE,0,6,Anaphoric,I asked
257,257,257, said he. ,"Why, we have got him, that s all, /newquote I know a dog that would follow that scent to the world s end. If a pack can track a trailed herring across a shire, how far can a specially-trained hound follow so pungent a smell as this? It sounds like a sum in the rule of three. The answer should give us the But halloa! here are the accredited representatives of the law.",Mr. Sherlock Holmes,Dr. Watson,NO MONOLOGUE,0,6,Anaphoric,said he
259,259,259," said Holmes, ","Before they come, /newquote just put your hand here on this poor fellow s arm, and here on his leg. What do you feel?",Mr. Sherlock Holmes,Dr. Watson,NO MONOLOGUE,0,6,Explicit,said Holmes
260,260,260, I answered.,"The muscles are as hard as a board,",Dr. Watson,Mr. Sherlock Holmes,NO MONOLOGUE,0,6,Anaphoric,I answered
261,261,261,NO APPEND,"Quite so. They are in a state of extreme contraction, far exceeding the usual _rigor mortis_. Coupled with this distortion of the face, this Hippocratic smile, or  _risus sardonicus_,  as the old writers called it, what conclusion would it suggest to your mind?",Mr. Sherlock Holmes,Dr. Watson,NO MONOLOGUE,0,6,Implicit,
262,262,262," I answered, ","Death from some powerful vegetable alkaloid, /newquote some strychnine-like substance which would produce tetanus.",Dr. Watson,Mr. Sherlock Holmes,NO MONOLOGUE,0,6,Anaphoric,I answered
263,263,263,NO APPEND,"That was the idea which occurred to me the instant I saw the drawn muscles of the face. On getting into the room I at once looked for the means by which the poison had entered the system. As you saw, I discovered a thorn which had been driven or shot with no great force into the scalp. You observe that the part struck was that which would be turned towards the hole in the ceiling if the man were erect in his chair. Now examine the thorn.",Mr. Sherlock Holmes,Dr. Watson,NO MONOLOGUE,0,6,Implicit,
265,265,265, he asked.,Is that an English thorn?,Mr. Sherlock Holmes,Dr. Watson,NO MONOLOGUE,0,6,Anaphoric,he asked
266,266,266,NO APPEND,"No, it certainly is not.",Dr. Watson,Mr. Sherlock Holmes,NO MONOLOGUE,0,6,Implicit,
267,267,267,NO APPEND,With all these data you should be able to draw some just inference. But here are the regulars; so the auxiliary forces may beat a retreat.,Mr. Sherlock Holmes,Dr. Watson,NO MONOLOGUE,0,6,Implicit,
282,282,282," remarked Holmes, shrugging his shoulders. ","He can find something, /newquote He has occasional glimmerings of reason. _Il n y a pas des sots si incommodes que ceux qui ont de l esprit!_",Mr. Sherlock Holmes,Dr. Watson,NO MONOLOGUE,0,6,Explicit,remarked Holmes
294,294,294,"He led me out to the head of the stair.  /newquote  he said, ","This unexpected occurrence, /newquote has caused us rather to lose sight of the original purpose of our journey.",Mr. Sherlock Holmes,Dr. Watson,NO MONOLOGUE,0,6,Anaphoric,he said
295,295,295, I answered. ,"I have just been thinking so, /newquote It is not right that Miss Morstan should remain in this stricken house.",Dr. Watson,Mr. Sherlock Holmes,NO MONOLOGUE,0,6,Anaphoric,I answered
296,296,296,NO APPEND,"No. You must escort her home. She lives with Mrs. Cecil Forrester, in Lower Camberwell: so it is not very far. I will wait for you here if you will drive out again. Or perhaps you are too tired?",Mr. Sherlock Holmes,Dr. Watson,NO MONOLOGUE,0,6,Implicit,
297,297,297,NO APPEND,"By no means. I don t think I could rest until I know more of this fantastic business. I have seen something of the rough side of life, but I give you my word that this quick succession of strange surprises to-night has shaken my nerve completely. I should like, however, to see the matter through with you, now that I have got so far.",Dr. Watson,Mr. Sherlock Holmes,NO MONOLOGUE,0,6,Implicit,
298,298,298, he answered. ,"Your presence will be of great service to me, /newquote We shall work the case out independently, and leave this fellow Jones to exult over any mare s-nest which he may choose to construct. When you have dropped Miss Morstan I wish you to go on to No. 3, Pinchin Lane, down near the water s edge at Lambeth. The third house on the right-hand side is a bird-stuffer s: Sherman is the name. You will see a weasel holding a young rabbit in the window. Knock old Sherman up, and tell him, with my compliments, that I want Toby at once. You will bring Toby back in the cab with you.",Mr. Sherlock Holmes,Dr. Watson,NO MONOLOGUE,0,6,Anaphoric,he answered
299,299,299,NO APPEND,"A dog, I suppose.",Dr. Watson,Mr. Sherlock Holmes,NO MONOLOGUE,0,6,Implicit,
300,300,300,NO APPEND,"Yes, a queer mongrel, with a most amazing power of scent. I would rather have Toby s help than that of the whole detective force of London.",Mr. Sherlock Holmes,Dr. Watson,NO MONOLOGUE,0,6,Implicit,
301,301,301, said I. ,"I shall bring him, then, /newquote It is one now. I ought to be back before three, if I can get a fresh horse.",Dr. Watson,Mr. Sherlock Holmes,NO MONOLOGUE,0,6,Anaphoric,said I
302,302,302," said Holmes, ","And I, /newquote shall see what I can learn from Mrs. Bernstone, and from the Indian servant, who, Mr. Thaddeus tell me, sleeps in the next garret. Then I shall study the great Jones s methods and listen to his not too delicate sarcasms.  _Wir sind gewohnt das die Menschen verh hnen was sie nicht verstehen._  Goethe is always pithy.",Mr. Sherlock Holmes,Dr. Watson,NO MONOLOGUE,0,6,Explicit,said Holmes
308,308,308, said the face. ,"Go on, you drunken vagabone, /newquote If you kick up any more row I ll open the kennels and let out forty-three dogs upon you.",Mr. Sherman,Dr. Watson,NO MONOLOGUE,0,7,Anaphoric,said the face
309,309,309, said I.,"If you ll let one out it s just what I have come for,",Dr. Watson,Mr. Sherman,NO MONOLOGUE,0,7,Anaphoric,said I
310,310,310, yelled the voice. ,"Go on! /newquote So help me gracious, I have a wiper in the bag, an  I ll drop it on your  ead if you don t hook it.",Mr. Sherman,Dr. Watson,NO MONOLOGUE,0,7,Anaphoric,yelled the voice
311,311,311, I cried.,"But I want a dog,",Dr. Watson,Mr. Sherman,NO MONOLOGUE,0,7,Anaphoric,I cried
312,312,312, shouted Mr. Sherman. ,"I won t be argued with! /newquote Now stand clear, for when I say  three,  down goes the wiper.",Mr. Sherman,Dr. Watson,NO MONOLOGUE,0,7,Explicit,shouted Mr Sherman
313,313,313," I began, but the words had a most magical effect, for the window instantly slammed down, and within a minute the door was unbarred and open. Mr. Sherman was a lanky, lean old man, with stooping shoulders, a stringy neck, and blue-tinted glasses.",Mr. Sherlock Holmes ,Dr. Watson,Mr. Sherman,NO MONOLOGUE,0,7,Anaphoric,I began
314,314,314, said he.  /newquote  This to a stoat which thrust its wicked head and red eyes between the bars of its cage. ,"A friend of Mr. Sherlock is always welcome, /newquote Step in, sir. Keep clear of the badger; for he bites. Ah, naughty, naughty, would you take a nip at the gentleman? /newquote Don t mind that, sir: it s only a slow-worm. It hain t got no fangs, so I gives it the run o  the room, for it keeps the beetles down. You must not mind my bein  just a little short wi  you at first, for I m guyed at by the children, and there s many a one just comes down this lane to knock me up. What was it that Mr. Sherlock Holmes wanted, sir?",Mr. Sherman,Dr. Watson,NO MONOLOGUE,0,7,Anaphoric,said he
315,315,315,NO APPEND,He wanted a dog of yours.,Dr. Watson,Mr. Sherman,NO MONOLOGUE,0,7,Implicit,
316,316,316,NO APPEND,Ah! that would be Toby.,Mr. Sherman,Dr. Watson,NO MONOLOGUE,0,7,Implicit,
317,317,317,NO APPEND,"Yes, Toby was the name.",Dr. Watson,Mr. Sherman,NO MONOLOGUE,0,7,Implicit,
318,318,318," He moved slowly forward with his candle among the queer animal family which he had gathered round him. In the uncertain, shadowy light I could see dimly that there were glancing, glimmering eyes peeping down at us from every cranny and corner. Even the rafters above our heads were lined by solemn fowls, who lazily shifted their weight from one leg to the other as our voices disturbed their slumbers.",Toby lives at No. 7 on the left here.,Mr. Sherman,Dr. Watson,NO MONOLOGUE,0,7,Implicit,
321,321,321, said he. ,"Ah, you have him there! /newquote Good dog, then! Atheney Jones has gone. We have had an immense display of energy since you left. He has arrested not only friend Thaddeus, but the gatekeeper, the housekeeper, and the Indian servant. We have the place to ourselves, but for a sergeant upstairs. Leave the dog here, and come up.",Mr. Sherlock Holmes,Dr. Watson,NO MONOLOGUE,0,7,Anaphoric,said he
325,325,325, he said. ,"I wish you particularly to notice these footmarks, /newquote Do you observe anything noteworthy about them?",Mr. Sherlock Holmes,Dr. Watson,NO MONOLOGUE,0,7,Anaphoric,he said
326,326,326," I said, ","They belong, /newquote to a child or a small woman.",Dr. Watson,Mr. Sherlock Holmes,NO MONOLOGUE,0,7,Anaphoric,I said
327,327,327,NO APPEND,"Apart from their size, though. Is there nothing else?",Mr. Sherlock Holmes,Dr. Watson,NO MONOLOGUE,0,7,Implicit,
328,328,328,NO APPEND,They appear to be much as other footmarks.,Dr. Watson,Mr. Sherlock Holmes,NO MONOLOGUE,0,7,Implicit,
329,329,329,NO APPEND,Not at all. Look here! This is the print of a right foot in the dust. Now I make one with my naked foot beside it. What is the chief difference?,Mr. Sherlock Holmes,Dr. Watson,NO MONOLOGUE,0,7,Implicit,
330,330,330,NO APPEND,Your toes are all cramped together. The other print has each toe distinctly divided.,Dr. Watson,Mr. Sherlock Holmes,NO MONOLOGUE,0,7,Implicit,
331,331,331,NO APPEND,"Quite so. That is the point. Bear that in mind. Now, would you kindly step over to that flap-window and smell the edge of the wood-work? I shall stay here, as I have this handkerchief in my hand.",Mr. Sherlock Holmes,Dr. Watson,NO MONOLOGUE,0,7,Implicit,
333,333,333,NO APPEND,"That is where he put his foot in getting out. If _you_ can trace him, I should think that Toby will have no difficulty. Now run downstairs, loose the dog, and look out for Blondin.",Mr. Sherlock Holmes,Dr. Watson,NO MONOLOGUE,0,7,Implicit,
335,335,335, he cried.,"That you, Watson?",Mr. Sherlock Holmes,Dr. Watson,NO MONOLOGUE,0,7,Anaphoric,he cried
336,336,336,NO APPEND,Yes.,Dr. Watson,Mr. Sherlock Holmes,NO MONOLOGUE,0,7,Implicit,
337,337,337,NO APPEND,This is the place. What is that black thing down there?,Mr. Sherlock Holmes,Dr. Watson,NO MONOLOGUE,0,7,Implicit,
338,338,338,NO APPEND,A water-barrel.,Dr. Watson,Mr. Sherlock Holmes,NO MONOLOGUE,0,7,Implicit,
339,339,339,NO APPEND,Top on it?,Mr. Sherlock Holmes,Dr. Watson,NO MONOLOGUE,0,7,Implicit,
340,340,340,NO APPEND,Yes.,Dr. Watson,Mr. Sherlock Holmes,NO MONOLOGUE,0,7,Implicit,
341,341,341,NO APPEND,No sign of a ladder?,Mr. Sherlock Holmes,Dr. Watson,NO MONOLOGUE,0,7,Implicit,
342,342,342,NO APPEND,No.,Mr. Sherlock Holmes,Dr. Watson,NO MONOLOGUE,0,7,Implicit,
343,343,343,NO APPEND,"Confound the fellow! It s a most break-neck place. I ought to be able to come down where he could climb up. The water-pipe feels pretty firm. Here goes, anyhow.",Mr. Sherlock Holmes,Dr. Watson,NO MONOLOGUE,0,7,Implicit,
345,345,345," he said, drawing on his stockings and boots. ","It was easy to follow him, /newquote Tiles were loosened the whole way along, and in his hurry he had dropped this. It confirms my diagnosis, as you doctors express it.",Mr. Sherlock Holmes,Dr. Watson,NO MONOLOGUE,0,7,Anaphoric,he said
347,347,347, said he. ,"They are hellish things, /newquote Look out that you don t prick yourself. I m delighted to have them, for the chances are that they are all he has. There is the less fear of you or me finding one in our skin before long. I would sooner face a Martini bullet, myself. Are you game for a six-mile trudge, Watson?",Mr. Sherlock Holmes,Dr. Watson,NO MONOLOGUE,0,7,Anaphoric,said he
348,348,348, I answered.,"Certainly,",Dr. Watson,Mr. Sherlock Holmes,NO MONOLOGUE,0,7,Anaphoric,I answered
349,349,349,NO APPEND,Your leg will stand it?,Mr. Sherlock Holmes,Dr. Watson,NO MONOLOGUE,0,7,Implicit,
350,350,350,NO APPEND,"Oh, yes.",Dr. Watson,Mr. Sherlock Holmes,NO MONOLOGUE,0,7,Implicit,
351,351,351," He pushed the creasote handkerchief under the dog s nose, while the creature stood with its fluffy legs separated, and with a most comical cock to its head, like a connoisseur sniffing the _bouquet_ of a famous vintage. Holmes then threw the handkerchief to a distance, fastened a stout cord to the mongrel s collar, and led him to the foot of the water-barrel. The creature instantly broke into a succession of high, tremulous yelps, and, with his nose on the ground, and his tail in the air, pattered off upon the trail at a pace which strained his leash and kept us at the top of our speed.","Here you are, doggy! Good old Toby! Smell it, Toby, smell it!",Mr. Sherlock Holmes,Dr. Watson,NO MONOLOGUE,0,7,Implicit,
354,354,354," he remarked, as I mounted up beside him. ","There s the print of wooden-leg s hand, /newquote You see the slight smudge of blood upon the white plaster. What a lucky thing it is that we have had no very heavy rain since yesterday! The scent will lie upon the road in spite of their eight-and-twenty hours  start.",Mr. Sherlock Holmes,Dr. Watson,NO MONOLOGUE,0,7,Anaphoric,he remarked
356,356,356," said Holmes, ","Do not imagine, /newquote that I depend for my success in this case upon the mere chance of one of these fellows having put his foot in the chemical. I have knowledge now which would enable me to trace them in many different ways. This, however, is the readiest and, since fortune has put it into our hands, I should be culpable if I neglected it. It has, however, prevented the case from becoming the pretty little intellectual problem which it at one time promised to be. There might have been some credit to be gained out of it, but for this too palpable clue.",Mr. Sherlock Holmes,Dr. Watson,NO MONOLOGUE,0,7,Explicit,said Holmes
357,357,357, said I. ,"There is credit, and to spare, /newquote I assure you, Holmes, that I marvel at the means by which you obtain your results in this case, even more than I did in the Jefferson Hope Murder. The thing seems to me to be deeper and more inexplicable. How, for example, could you describe with such confidence the wooden-legged man?",Dr. Watson,Mr. Sherlock Holmes,NO MONOLOGUE,0,7,Anaphoric,said I
358,358,358,NO APPEND,"Pshaw, my dear boy! it was simplicity itself. I don t wish to be theatrical. It is all patent and above-board. Two officers who are in command of a convict-guard learn an important secret as to buried treasure. A map is drawn for them by an Englishman named Jonathan Small. You remember that we saw the name upon the chart in Captain Morstan s possession. He had signed it in behalf of himself and his associates, the sign of the four, as he somewhat dramatically called it. Aided by this chart, the officers or one of them gets the treasure and brings it to England, leaving, we will suppose, some condition under which he received it unfulfilled. Now, then, why did not Jonathan Small get the treasure himself? The answer is obvious. The chart is dated at a time when Morstan was brought into close association with convicts. Jonathan Small did not get the treasure because he and his associates were themselves convicts and could not get away.",Mr. Sherlock Holmes,Dr. Watson,NO MONOLOGUE,0,7,Implicit,
359,359,359, said I.,"But that is mere speculation,",Dr. Watson,Mr. Sherlock Holmes,NO MONOLOGUE,0,7,Anaphoric,said I
360,360,360,NO APPEND,"It is more than that. It is the only hypothesis which covers the facts. Let us see how it fits in with the sequel. Major Sholto remains at peace for some years, happy in the possession of his treasure. Then he receives a letter from India which gives him a great fright. What was that?",Mr. Sherlock Holmes,Dr. Watson,NO MONOLOGUE,0,7,Implicit,
361,361,361,NO APPEND,A letter to say that the men whom he had wronged had been set free.,Dr. Watson,Mr. Sherlock Holmes,NO MONOLOGUE,0,7,Implicit,
362,362,362,NO APPEND,"Or had escaped. That is much more likely, for he would have known what their term of imprisonment was. It would not have been a surprise to him. What does he do then? He guards himself against a wooden-legged man, a white man, mark you, for he mistakes a white tradesman for him, and actually fires a pistol at him. Now, only one white man s name is on the chart. The others are Hindoos or Mohammedans. There is no other white man. Therefore we may say with confidence that the wooden-legged man is identical with Jonathan Small. Does the reasoning strike you as being faulty?",Mr. Sherlock Holmes,Dr. Watson,NO MONOLOGUE,0,7,Implicit,
363,363,363,NO APPEND,No: it is clear and concise.,Dr. Watson,Mr. Sherlock Holmes,NO MONOLOGUE,0,7,Implicit,
364,364,364,NO APPEND,"Well, now, let us put ourselves in the place of Jonathan Small. Let us look at it from his point of view. He comes to England with the double idea of regaining what he would consider to be his rights and of having his revenge upon the man who had wronged him. He found out where Sholto lived, and very possibly he established communications with some one inside the house. There is this butler, Lal Rao, whom we have not seen. Mrs. Bernstone gives him far from a good character. Small could not find out, however, where the treasure was hid, for no one ever knew, save the major and one faithful servant who had died. Suddenly Small learns that the major is on his death-bed. In a frenzy lest the secret of the treasure die with him, he runs the gauntlet of the guards, makes his way to the dying man s window, and is only deterred from entering by the presence of his two sons. Mad with hate, however, against the dead man, he enters the room that night, searches his private papers in the hope of discovering some memorandum relating to the treasure, and finally leaves a momento of his visit in the short inscription upon the card. He had doubtless planned beforehand that should he slay the major he would leave some such record upon the body as a sign that it was not a common murder, but, from the point of view of the four associates, something in the nature of an act of justice. Whimsical and bizarre conceits of this kind are common enough in the annals of crime, and usually afford valuable indications as to the criminal. Do you follow all this?",Mr. Sherlock Holmes,Dr. Watson,NO MONOLOGUE,0,7,Implicit,
365,365,365,NO APPEND,Very clearly.,Dr. Watson,Mr. Sherlock Holmes,NO MONOLOGUE,0,7,Implicit,
366,366,366,NO APPEND,"Now, what could Jonathan Small do? He could only continue to keep a secret watch upon the efforts made to find the treasure. Possibly he leaves England and only comes back at intervals. Then comes the discovery of the garret, and he is instantly informed of it. We again trace the presence of some confederate in the household. Jonathan, with his wooden leg, is utterly unable to reach the lofty room of Bartholomew Sholto. He takes with him, however, a rather curious associate, who gets over this difficulty, but dips his naked foot into creasote, whence comes Toby, and a six-mile limp for a half-pay officer with a damaged tendo Achillis.",Mr. Sherlock Holmes,Dr. Watson,NO MONOLOGUE,0,7,Implicit,
367,367,367,NO APPEND,"But it was the associate, and not Jonathan, who committed the crime.",Dr. Watson,Mr. Sherlock Holmes,NO MONOLOGUE,0,7,Implicit,
368,368,368,NO APPEND,"Quite so. And rather to Jonathan s disgust, to judge by the way he stamped about when he got into the room. He bore no grudge against Bartholomew Sholto, and would have preferred if he could have been simply bound and gagged. He did not wish to put his head in a halter. There was no help for it, however: the savage instincts of his companion had broken out, and the poison had done its work: so Jonathan Small left his record, lowered the treasure-box to the ground, and followed it himself. That was the train of events as far as I can decipher them. Of course as to his personal appearance he must be middle-aged, and must be sunburned after serving his time in such an oven as the Andamans. His height is readily calculated from the length of his stride, and we know that he was bearded. His hairiness was the one point which impressed itself upon Thaddeus Sholto when he saw him at the window. I don t know that there is anything else.",Mr. Sherlock Holmes,Dr. Watson,NO MONOLOGUE,0,7,Implicit,
369,369,369,NO APPEND,The associate?,Dr. Watson,Mr. Sherlock Holmes,NO MONOLOGUE,0,7,Implicit,
370,370,370,NO APPEND,"Ah, well, there is no great mystery in that. But you will know all about it soon enough. How sweet the morning air is! See how that one little cloud floats like a pink feather from some gigantic flamingo. Now the red rim of the sun pushes itself over the London cloud-bank. It shines on a good many folk, but on none, I dare bet, who are on a stranger errand than you and I. How small we feel with our petty ambitions and strivings in the presence of the great elemental forces of nature! Are you well up in your Jean Paul?",Mr. Sherlock Holmes,Dr. Watson,NO MONOLOGUE,0,7,Implicit,
