,Unnamed: 0,paragraph,append,dialogue,speaker,addressee,subject,sentiment,chapter,syntactic,referringExpression
654,654,654," I said, taking her hand. She did not withdraw it. ","Because you are within my reach again, /newquote Because I love you, Mary, as truly as ever a man loved a woman. Because this treasure, these riches, sealed my lips. Now that they are gone I can tell you how I love you. That is why I said,  Thank God. ",Dr. Watson,Miss Morstan,NO MONOLOGUE,0,11,Anaphoric,I said
655,655,655," she whispered, as I drew her to my side. Whoever had lost a treasure, I knew that night that I had gained one.","Then I say,  Thank God,  too,",Miss Morstan,Dr. Watson,NO MONOLOGUE,0,11,Anaphoric,she whispered
658,658,658," said he, gloomily. ",There goes the reward! /newquote Where there is no money there is no pay. This night s work would have been worth a tenner each to Sam Brown and me if the treasure had been there.,"A Bluff, Genial Inspector",Dr. Watson,NO MONOLOGUE,0,12,Anaphoric,said he
659,659,659, I said. ,"Mr. Thaddeus Sholto is a rich man, /newquote He will see that you are rewarded, treasure or no.",Dr. Watson,"A Bluff, Genial Inspector",NO MONOLOGUE,0,12,Anaphoric,I said
660,660,660,"The inspector shook his head despondently, however.  /newquote  he repeated; ","It s a bad job, /newquote and so Mr. Athelney Jones will think.","A Bluff, Genial Inspector",Dr. Watson,NO MONOLOGUE,0,12,Anaphoric,he repeated
686,686,686,NO APPEND," I will swear it,  I answered,  provided that the fort is not endangered. ",Mr. Sherlock Holmes,Dr. Watson,NO MONOLOGUE,0,12,Implicit,
688,688,688,NO APPEND," There are but three,  said I.",Mr. Sherlock Holmes,Dr. Watson,NO MONOLOGUE,0,12,Implicit,
696,696,696,NO APPEND," Does your brother know, then, of what you will do?  I asked.",Mr. Sherlock Holmes,Dr. Watson,NO MONOLOGUE,0,12,Implicit,
697,697,697,NO APPEND, The plan is his. He has devised it. We will go to the gate and share the watch with Mahomet Singh. ,Mr. Sherlock Holmes,Dr. Watson,NO MONOLOGUE,0,12,Implicit,
701,701,701,NO APPEND," You will challenge him, Sahib, as usual,  whispered Abdullah.  Give him no cause for fear. Send us in with him, and we shall do the rest while you stay here on guard. Have the lantern ready to uncover, that we may be sure that it is indeed the man. ",Mr. Sherlock Holmes,Dr. Watson,NO MONOLOGUE,0,12,Implicit,
706,706,706,NO APPEND, What have you in the bundle?  I asked.,Mr. Sherlock Holmes,Dr. Watson,NO MONOLOGUE,0,12,Implicit,
727,727,727,NO APPEND," I wish to have your advice, major,  said I.",Mr. Sherlock Holmes,Dr. Watson,NO MONOLOGUE,0,12,Implicit,
731,731,731,NO APPEND," Quite that, sir, in jewels and pearls. It lies there ready for any one. And the queer thing about it is that the real owner is outlawed and cannot hold property, so that it belongs to the first comer. ",Mr. Sherlock Holmes,Dr. Watson,NO MONOLOGUE,0,12,Implicit,
733,733,733,NO APPEND," You think, then, sir, that I should give the information to the Governor-General?  said I, quietly.",Mr. Sherlock Holmes,Dr. Watson,NO MONOLOGUE,0,12,Anaphoric,he said
773,773,773," I remarked, after we had set some time smoking in silence. ","Well, and there is the end of our little drama, /newquote I fear that it may be the last investigation in which I shall have the chance of studying your methods. Miss Morstan has done me the honour to accept me as a husband in prospective.",Dr. Watson,Mr. Sherlock Holmes,NO MONOLOGUE,0,12,Anaphoric,I remarked
774,774,774,He gave a most dismal groan.  /newquote  said he. ,"I feared as much, /newquote I really cannot congratulate you.",Mr. Sherlock Holmes,Dr. Watson,NO MONOLOGUE,0,12,Anaphoric,said he
775,775,775,I was a little hurt.  /newquote  I asked.,Have you any reason to be dissatisfied with my choice?,Dr. Watson,Mr. Sherlock Holmes,NO MONOLOGUE,0,12,Anaphoric,I asked
776,776,776,NO APPEND,"Not at all. I think she is one of the most charming young ladies I ever met, and might have been most useful in such work as we have been doing. She had a decided genius that way: witness the way in which she preserved that Agra plan from all the other papers of her father. But love is an emotional thing, and whatever is emotional is opposed to that true cold reason which I place above all things. I should never marry myself, lest I bias my judgment.",Mr. Sherlock Holmes,Dr. Watson,NO MONOLOGUE,0,12,Implicit,
777,777,777," said I, laughing, ","I trust, /newquote that my judgment may survive the ordeal. But you look weary.",Dr. Watson,Mr. Sherlock Holmes,NO MONOLOGUE,0,12,Anaphoric,said I
778,778,778,NO APPEND,"Yes, the reaction is already upon me. I shall be as limp as a rag for a week.",Mr. Sherlock Holmes,Dr. Watson,NO MONOLOGUE,0,12,Implicit,
779,779,779," said I, ","Strange, /newquote how terms of what in another man I should call laziness alternate with your fits of splendid energy and vigour.",Dr. Watson,Mr. Sherlock Holmes,NO MONOLOGUE,0,12,Anaphoric,said I
780,780,780," he answered, ","Yes, /newquote there are in me the makings of a very fine loafer and also of a pretty spry sort of fellow. I often think of those lines of old Goethe, ",Mr. Sherlock Holmes,Dr. Watson,NO MONOLOGUE,0,12,Anaphoric,he answered
782,782,782,NO APPEND,"By the way, _  propos_ of this Norwood business, you see that they had, as I surmised, a confederate in the house, who could be none other than Lal Rao, the butler: so Jones actually has the undivided honour of having caught one fish in his great haul.",Mr. Sherlock Holmes,Dr. Watson,NO MONOLOGUE,0,12,Anaphoric,he answered
783,783,783, I remarked. ,"The division seems rather unfair, /newquote You have done all the work in this business. I get a wife out of it, Jones gets the credit, pray what remains for you?",Dr. Watson,Mr. Sherlock Holmes,NO MONOLOGUE,0,12,Anaphoric,I remarked
784,784,784," said Sherlock Holmes,  /newquote  And he stretched his long white hand up for it.","For me, /newquote there still remains the cocaine-bottle.",Mr. Sherlock Holmes,Dr. Watson,NO MONOLOGUE,0,12,Explicit,said Sherlock Holmes
